,id,name,price,in_stock,link
1258,1497488390,Джуманджі,388.0,True,https://gameland.com.ua/dzhumandzhi/
1259,1497488633,Витоки. Схід цивілізацій (Origins: First Builders),1440.0,True,https://gameland.com.ua/vitoki.-skhid-tsivilizatsiy/
1260,1497489413,Ферма Люкс (рос.),312.0,True,https://gameland.com.ua/ferma-lіuks-ros./
1261,1497490970,Ніч для двох,221.0,True,https://gameland.com.ua/nich-dlia-dvokh/
1262,1497489303,Правда або дія: Для двох,378.0,True,https://gameland.com.ua/pravda-abo-diia-dlia-dvokh/
1263,1497491567,Чекова книжка бажань для подруг,180.0,True,https://gameland.com.ua/chekova-knyzhka-bazhan-dlia-podruh/
1264,1497491568,Чекова книжка бажань дня неї. Насолода,180.0,True,https://gameland.com.ua/chekova-knyzhka-bazhan-dnia-nei.-nasoloda/
1265,1497491570,Чекова книжка бажань дня неї. Моменти,180.0,True,https://gameland.com.ua/chekova-knyzhka-bazhan-dnia-nei.-momenty/
1266,1497491571,Чекова книжка бажань дня нього. Пригоди,180.0,True,https://gameland.com.ua/chekova-knyzhka-bazhan-dnia-noho.-pryhody/
1267,1497491572,Чекова книжка бажань для мами,180.0,True,https://gameland.com.ua/chekova-knyzhka-bazhan-dlia-mamy/
1268,1497491569,Чекова книжка бажань дня нього. Спокуса,180.0,True,https://gameland.com.ua/chekova-knyzhka-bazhan-dnia-noho.-spokusa/
1269,1438705393,Експрес тістечко,744.0,True,https://gameland.com.ua/ekspres-tistechko/
1270,1497489006,Хвалькувата жаба,320.0,True,https://gameland.com.ua/khvalkuvata-zhaba/
1271,1497489302,Правда або дія: Для двох (рос.),378.0,True,https://gameland.com.ua/pravda-abo-diia-dlia-dvokh-ros./
1272,1497488380,АБВГДейка. Протилежності,260.0,True,https://gameland.com.ua/abvgdeyka.-protilezhnosti/
1273,1497488381,АБВГДейка. Пори року,248.0,True,https://gameland.com.ua/abvgdeyka.-pori-roku/
1274,1497488453,Гра про країни,759.0,True,https://gameland.com.ua/gra-pro-kraini/
1275,1497488111,Володарі морів,432.0,True,https://gameland.com.ua/volodari-moriv/
1276,1497488382,АБВГДейка. Кольори та фігури,224.0,True,https://gameland.com.ua/abvgdeyka.-kolori-ta-figuri/
1277,1497488993,Айс-перегони,336.0,True,https://gameland.com.ua/ays-peregoni/
1278,1497488995,Банановий рай (рос.),251.0,True,https://gameland.com.ua/bananoviy-ray-ros./
1279,1497488996,У пошуках скарбів (рос.),319.0,True,https://gameland.com.ua/u-poshukakh-skarbiv-ros./
1280,1497488997,Лавка чудес (рос.),293.0,True,https://gameland.com.ua/lavka-chudes-ros./
1281,1497489415,Тік Так Бумм дитячий,816.0,True,https://gameland.com.ua/tik-tak-bumm-dytiachyi/
1282,1497488384,Перші відкриття. Цікаві цифри,200.0,True,https://gameland.com.ua/pershi-vidkrittya.-tsikavi-tsifri/
1283,1497488385,Перші відкриття. Асоціації,264.0,True,https://gameland.com.ua/pershi-vidkrittya.-asotsiatsii/
1284,1497488856,Маятник (Pendulum),1440.0,True,https://gameland.com.ua/mayatnik/
1285,1497488862,Чорний ангел (Black Angel),2160.0,True,https://gameland.com.ua/chorniy-angel/
1286,1345861180,Еліас. Україна (Alias Ukraine),872.0,True,https://gameland.com.ua/elias.-ukraina/
1287,1345861187,Еліас для дітей. Дорожня версія (Alias Junior Travel) (рос.),356.0,True,https://gameland.com.ua/elias-dlya-ditey.-dorozhnya-versiya/
1288,1497487969,КотоБанда,344.0,True,https://gameland.com.ua/kotobanda/
1289,1497487955,Зоорегата (ZOOregata),476.0,True,https://gameland.com.ua/zooregata-zooregata/
1290,1427605594,Детектив Клуб: Нуар,384.0,True,https://gameland.com.ua/detektiv-klub-nuar/
1291,1497488401,Колекційна коробка для гри Трон Кубів. Перший сезон. Перезавантаження,1140.0,True,https://gameland.com.ua/kolektsiyna-korobka-dlya-gri-tron-kubiv.-pershiy-sezon.-perezavantazhennya/
1292,1497488183,Війна Персня. Воїни Середзем'я (War of the Ring: Warriors of Middle Earth),1720.0,True,https://gameland.com.ua/viyna-kiltsya.-voini-seredzemya/
1293,1497488182,Війна Персня. Володарі Середзем’я (War of the Ring: Lords of Middle-earth),1120.0,True,https://gameland.com.ua/viyna-kiltsya.-vladiki-seredzemya/
1294,1478653193,Пройдисвіти Кведлінбурга. Відьми-травниці (The Quacks of Quedlinburg. The Herb Witches),984.0,True,https://gameland.com.ua/proydisviti-kvedlinburga.-vidmi-travnitsi-the-quacks-of-quedlinburg.-the-herb-witches-ukr./
1295,1497488161,Пандемія. На межі (Pandemic: On the Brink),996.0,True,https://gameland.com.ua/pandemiya.-na-mezhi-ukr./
1296,1497489812,Безодня. Кракен & Левіафан,1436.0,True,https://gameland.com.ua/bezodnia.-kraken-leviafan/
1297,1497489713,Concordia: Venus (Expansion),1400.0,True,https://gameland.com.ua/concordia-venus-expansion/
1298,1497488755,Marvel United: У всесвіті Людини-павука (Marvel United: Enter the Spider-Verse),796.0,True,https://gameland.com.ua/marvel-united-u-vsesviti-ludini-pavuka/
1299,1497488326,Поселенці. Північні Імперії: Японські острови (англ.),720.0,True,https://gameland.com.ua/poselentsi.-pivnichni-imperii-yaponski-ostrovi/
1300,1497488115,Поселенці. Північні Імперії: Римські прапори (англ.),720.0,True,https://gameland.com.ua/poselentsi.-pivnichni-imperii-rimski-prapori/
1301,1497489053,Живопис: Відображення (Canvas: Reflections),916.0,True,https://gameland.com.ua/canvas-reflections-angl./
1302,1497488075,Ініш. Сезони (Inis: Seasons of Inis),1472.0,True,https://gameland.com.ua/inish.-sezoni-inis-seasons-of-inis-ukr./
1303,1497488165,Root: Річкові народи (ROOT: The Riverfolk),1080.0,True,https://gameland.com.ua/korinnya-richkove-bratstvo/
1304,1497491683,Левада. За течією (Meadow: Downstream),1320.0,True,https://gameland.com.ua/levada.-za-techiieiu-meadow-downstream/
1305,1497489429,Нескінченна зима. Палеоамериканці: Пращури (Endless Winter: Ancestors),780.0,True,https://gameland.com.ua/neskinchenna-zyma.-paleoamerykantsi-prashchury-endless-winter-ancestors/
1306,1497490401,Вибухові кошенята: Сингулярні кошенята (Imploding Kittens),636.0,True,https://gameland.com.ua/exploding-kittens-imploding-kittens/
1307,GKCH195ti,Цивілізація. Новий світанок — Тера інкогніта (Civilization: A New Dawn – Terra Incognita),1680.0,True,https://gameland.com.ua/civilization-a-new-dawn-terra-incognita-angl./
1308,1489895052,Хижа планета. За обріями & Притулок (Exploration & Sanctuary),876.0,True,https://gameland.com.ua/khizha-planeta.-pritulok-dopovnennya/
1309,1497491230,Побратими: Знову в бій! (The Grizzled: At Your Orders!),440.0,True,https://gameland.com.ua/pobratymy-znovu-v-bii-the-grizzled-at-your-orders/
1310,1497491463,Ticket to Ride Map Collection 8: Iberia & South Korea,1680.0,True,https://gameland.com.ua/ticket-to-ride-map-collection-8-iberia-south-korea/
1311,1497488421,7 Чудес: Міста (7 Wonders: Cities),756.0,True,https://gameland.com.ua/7-chudes-mista-ukr./
1312,1497488284,Жах Аркгема. Третя редакція: Нічний морок (Arkham Horror: Dead of Night),1000.0,True,https://gameland.com.ua/zhakh-arkkhema.-tretya-redaktsiya-u-temryavi-nochi/
1313,1497491154,Війна Персня. Доля Еребору (War of the Ring: The Fate of Erebor),360.0,True,https://gameland.com.ua/viina-persnia.-dolia-ereboru-war-of-the-ring-the-fate-of-erebor/
1314,1497488142,Такеноко: Чібіс (Takenoko: Chibis),720.0,True,https://gameland.com.ua/takenoko-chibis-ukr./
1315,1497489792,Пройдисвіти Кведлінбурга. Алхіміки,984.0,True,https://gameland.com.ua/proidysvity-kvedlinburha.-alkhimiky/
1316,1345861338,Тераформування Марса. Колонії (Terraforming Mars: Colonies) ,840.0,True,https://gameland.com.ua/pidkorennya-marsa-kolonii-terraforming-mars-colonies/
1317,1497488325,Imperial Settlers: Empires of the North – Barbarian Hordes,672.0,True,https://gameland.com.ua/poselentsi.-pivnichni-imperii-ordi-varvariv/
1318,1489316746,Хижа планета. За обріями & Притулок (Exploration & Sanctuary) (металева коробка),876.0,True,https://gameland.com.ua/khizha-planeta.-novi-gorizonti-dopovnennya/
1319,1497490536,Barrage: 5-Player Expansion (Гребля: 5-й гравець),920.0,True,https://gameland.com.ua/barrage-5-player-expansion-hreblia-5-i-hravets/
1320,1497491502,Catan: Мореплавці (Catan. Seafarers),1420.0,True,https://gameland.com.ua/catan-moreplavtsi-catan.-seafarers/
1321,1497490686,Загублені руїни Арнаку: Зникла експедиція,992.0,True,https://gameland.com.ua/zahubleni-ruiny-arnaku-znykla-ekspedytsiia/
1322,1497491387,Evergreen: Pines and Cacti (Сосни та Кактуси),712.0,True,https://gameland.com.ua/evergreen-pines-and-cacti-sosny-ta-kaktusy/
1323,1497491608,Загублені руїни Арнаку: Adventure Chest,3700.0,True,https://gameland.com.ua/zahubleni-ruiny-arnaku-adventure-chest/
1324,1497491605,Дюна. Імперіум - Династії (Dune: Imperium – Bloodlines),1520.0,True,https://gameland.com.ua/diuna.-imperium-dynastii-dune-imperium-bloodlines/
1325,1459480451,Тераформування Марса: Початок (Terraforming Mars: Prelude),600.0,True,https://gameland.com.ua/teraformuvannya-marsa-pochatok-ukr./
1326,1497488042,Лють крові. Чаклуни Мідґарду (Blood Rage: Mystics of Midgard),840.0,True,https://gameland.com.ua/krov-i-lut.-chakluni-midgarda-blood-rage-mystics-of-midgard/
1327,1497491504,Catan: Міста й лицарі (Catan: Cities & Knights),1990.0,True,https://gameland.com.ua/catan-mista-y-lytsari-catan-cities-knights/
1328,1497491153,Війна Персня. Королі Середзем’я (War of the Ring: Kings of Middle-earth),1480.0,True,https://gameland.com.ua/viina-persnia.-koroli-seredzemia-war-of-the-ring-kings-of-middle-earth/
1329,1497491519,Evergreen: Giant Trees and Mushrooms Expansion (Гігантські дерева та гриби),648.0,True,https://gameland.com.ua/evergreen-giant-trees-and-mushrooms-expansion-hihantski-dereva-ta-hryby/
1330,1434106123,Містеріум: Таємничі знаки,396.0,True,https://gameland.com.ua/misterium-taiemnichi-znaki-ukr./
1331,1433911572,Містеріум: Полонений часу,396.0,True,https://gameland.com.ua/misterium-poloneniy-chasu-ukr./
1332,1442112077,Містеріум. Прихований мотив (Mysterium: Hidden Motive),316.0,True,https://gameland.com.ua/misterium.-prikhovaniy-motiv-mysterium-hidden-motive/
1333,1497489105,Острів котів: Ще більше гостей (The Isle of Cats: Kickstarter Pack 2),780.0,True,https://gameland.com.ua/ostriv-kotiv-shche-bilshe-gostey/
1334,1497490639,Concordia: Aegyptus / Creta,544.0,True,https://gameland.com.ua/concordia-aegyptus-creta/
1335,1497491393,Кіклади. Легендарне видання - Монстри і герої (Cyclades: Creatures & Heroes),1080.0,True,https://gameland.com.ua/kiklady.-lehendarne-vydannia-monstry-i-heroi-cyclades-creatures-heroes/
1336,1497490517,Війна Персня. Карткова гра - Проти тіні (War of the Ring: The Card Game – Against the Shadow),660.0,True,https://gameland.com.ua/viina-persnia.-kartkova-hra-proty-tini-war-of-the-ring-the-card-game-against-the-shadow/
1337,1497490854,Призначення. Відьмин ліс (Destinies: Witchwood),1360.0,True,https://gameland.com.ua/pryznachennia.-vidmyn-lis-destinies-witchwood/
1338,1497488978,Війна Персня. Сценарій «Братство розпадається»,120.0,True,https://gameland.com.ua/viyna-persnya.-stsenariy-bratstvo-rozpadaietsya/
1339,1497489340,Крила. Птахи Азії (Wingspan: Asia),1356.0,True,https://gameland.com.ua/kryla.-ptakhy-azii-wingspan-asia/
1340,1497490542,Фростпанк: Замерзлі землі (Frostpunk: The Board Game - Frostlander Expansion),1235.0,True,https://gameland.com.ua/frostpunk-the-board-game-frostlander/
1341,1497491278,Бенґ! Додж-Сіті (BANG! DodgeCity),580.0,True,https://gameland.com.ua/beng-dodzh-siti-bang-dodgecity/
1342,1497490128,Everdell: Pearlbrook – Collector's Edition,2240.0,True,https://gameland.com.ua/everdell-pearlbrook-collectors-edition/
1343,1497490222,Everdell: Spirecrest – Collector's Edition,2160.0,True,https://gameland.com.ua/everdell-spirecrest-collectors-edition/
1344,1497491163,Лісова метушня. Альпи (Forest Shuffle: Alpine Expansion),360.0,True,https://gameland.com.ua/lisova-metushnia.-alpy-forest-shuffle-alpine-expansion/
1345,1497491151,Новий ковчег: Морські Світи (Ark Nova: Marine Worlds),879.0,True,https://gameland.com.ua/novyi-kovcheh-morski-svity-ark-nova-marine-worlds/
1346,1497491501,Catan: Доповнення для 5-6 гравців,941.0,True,https://gameland.com.ua/catan-dopovnennia-dlia-5-6-hravtsiv/
1347,1497491503,Catan: Мореплавці. Доповнення для 5-6 гравців,1120.0,True,https://gameland.com.ua/catan-moreplavtsi.-dopovnennia-dlia-5-6-hravtsiv/
1348,1497491505,Catan: Міста й лицарі. Доповнення для 5-6 гравців,1350.0,True,https://gameland.com.ua/catan-mista-y-lytsari.-dopovnennia-dlia-5-6-hravtsiv/
1349,1497490516,Немезида. Наслідки (Nemesis: Aftermath),2520.0,True,https://gameland.com.ua/nemezyda.-naslidky-nemesis-aftermath/
1350,1497490219,King of Tokyo/New York: Monster Pack – Cthulhu,392.0,True,https://gameland.com.ua/king-of-tokyo-new-york-monster-pack-cthulhu/
1351,1497491396,Таємні лідери. Забуті легенди (Hidden Leaders: Forgotten Legends),600.0,True,https://gameland.com.ua/taiemni-lidery.-zabuti-lehendy-hidden-leaders-forgotten-legends/
1352,1497489851,The Quest for El Dorado: Heroes & Hexes,880.0,True,https://gameland.com.ua/the-quest-for-el-dorado-heroes-hexes/
1353,1497491446,Новий Ковчег. Мапи зоопарків (Набір 2). Zoo Map Pack 2,399.0,True,https://gameland.com.ua/novyi-kovcheh.-mapy-zooparkiv-nabir-2.-zoo-map-pack-2/
1354,1497490130,Everdell: Bellfaire,1350.0,True,https://gameland.com.ua/everdell-bellfaire/
1355,1497491019,Евердел. Дзвінограй (Everdell: Bellfaire),1496.0,True,https://gameland.com.ua/everdel.-dzvinohrai-everdell-bellfaire/
1356,1497491101,Турбо: Дощі та грози (Heat: Heavy Rain),1088.0,True,https://gameland.com.ua/turbo-doshchi-ta-hrozy-heat-heavy-rain/
1357,1497491469,Зомбіцид. Біла смерть - Нескорена Імперія (Zombicide: White Death – Eternal Empire),2150.0,True,https://gameland.com.ua/zombitsyd.-bila-smert-neskorena-imperiia-zombicide-white-death-eternal-empire/
1358,1497491518,Potion Explosion - Fulminating Serum Potion Tiles,288.0,True,https://gameland.com.ua/potion-explosion-fulminating-serum-potion-tiles/
1359,1497491471,Саґрада. Життя (Sagrada: Life),760.0,True,https://gameland.com.ua/sagrada.-zhyttia-sagrada-life/
1360,1497491402,Маєтки божевілля. За порогом (Mansions of Madness: Beyond the Threshold),1080.0,True,https://gameland.com.ua/maietky-bozhevillia.-za-porohom-mansions-of-madness-beyond-the-threshold/
1361,1497491470,Саґрада. Пристрасть (Sagrada: Passion),760.0,True,https://gameland.com.ua/sagrada.-prystrast-sagrada-passion/
1362,1345717567,Діксіт 9: Ювілейне видання (Dixit 9: Anniversary),636.0,True,https://gameland.com.ua/diksit-9-uvileyne-vidannya-dixit-9-anniversary/
1363,1497487950,Діксіт 8: Гармонія (Dixit 8. Harmonies),636.0,True,https://gameland.com.ua/diksit-8-garmoniya-dixit-8.-harmonies/
1364,1463939505,Діксіт 7: Натхнення (Dixit 7. Revelation),636.0,True,https://gameland.com.ua/diksit-7-natkhnennya-dixit-7.-revelation/
1365,1345863929,Діксіт 5: Сни на яву (Dixit 5. Daydreams),636.0,True,https://gameland.com.ua/diksit-5-sni-na-yavu-dixit-5.-daydreams/
1366,1426679021,Діксіт 4: Витоки (Dixit 4: Origins),636.0,True,https://gameland.com.ua/diksit-4-vitoki-dixit-4-origins/
1367,1426666241,Діксіт 3: Подорожі (Dixit 3: Journey),636.0,True,https://gameland.com.ua/diksit-3-podorozhi-dixit-3-journey/
1368,1497491399,Colt Express: Happy 10th Anniversary (Кольт Експрес: з 10-ю річницею),743.0,True,https://gameland.com.ua/colt-express-happy-10th-anniversary-kolt-ekspres-z-10-iu-richnytseiu/
1369,1497487948,Діксіт 2: Пригоди (Dixit 2 Quest),636.0,True,https://gameland.com.ua/diksit-2-prigodi-dixit-2.-quest/
1370,1497487949,Діксіт 10: Дзеркала (Dixit 10: Mirrors),636.0,True,https://gameland.com.ua/diksit-10-dzerkala-dixit-10-mirrors/
1371,1497488170,7 Чудес: Армада (Wonder Armada),1116.0,True,https://gameland.com.ua/7-chudes-armada/
1372,1497491141,Крила. Фан Арт Пак (Wingspan: Fan Art Pack),756.0,True,https://gameland.com.ua/kryla.-fan-art-pak-wingspan-fan-art-pack/
1373,1497491072,Битви гербів. Набір доповнень #1 (Battlecrest: Expansion Collection #1),144.0,True,https://gameland.com.ua/bytvy-herbiv.-nabir-dopovnen-1-battlecrest-expansion-collection-1/
1374,1497489811,Distilled. Африка та Близький Схід,760.0,True,https://gameland.com.ua/distilled.-afryka-ta-blyzkyi-skhid/
1375,1497489839,Terra Mystica: Fire & Ice,1440.0,True,https://gameland.com.ua/terra-mystica-fire-ice/
1376,1497491037,Concordia: Solitaria,720.0,True,https://gameland.com.ua/concordia-solitaria/
1377,1497489874,Detective: Signature Series – Petty Officers,440.0,True,https://gameland.com.ua/detective-signature-series-petty-officers/
1378,1497488169,7 Чудес: Лідери (7 Wonders: Leaders),956.0,True,https://gameland.com.ua/7-chudes-lideri/
1379,1497491417,Kelp. Блискавичні рефлекси (Brilliant Behaviours Mini Expansion Set),560.0,True,https://gameland.com.ua/kelp.-blyskavychni-refleksy-brilliant-behaviours-mini-expansion-set/
1380,1437573200,Лють крові. П’ятий гравець (Blood Rage: 5th Player Expansion),1008.0,True,https://gameland.com.ua/krov-ta-lut-pyatiy-gravets/
1381,1437569026,Лють крові. Боги Асґарду (Blood Rage: Gods of Ásgard),672.0,True,https://gameland.com.ua/krov-ta-lut-bogi-asgarda/
1382,1497491439,Жах Аркгема. Карткова гра – На краю землі. Путівник по кампанії (Arkham Horror: The Card Game – Edge of the Earth: Campaign Expansion),2479.0,True,https://gameland.com.ua/zhakh-arkhema.-kartkova-hra-na-kraiu-zemli.-putivnyk-po-kampanii-arkham-horror-the-card-game-edge-of-the-earth-campaign-expansion/
1383,1497489411,Карти ТАРО ORNER x SestryFeldman (українська лімітована серія),700.0,True,https://gameland.com.ua/karty-taro-orner-x-sestryfeldman-ukrainska-limitovana-seriia/
1384,1497491394,Кіклади. Легендарне видання - Загони і флот (Cyclades: Troops & Fleets),2600.0,True,https://gameland.com.ua/kiklady.-lehendarne-vydannia-zahony-i-flot-cyclades-troops-fleets/
1385,1497491436,Фростпанк: Ресурси (Frostpunk: The Board Game - Resources),2512.0,True,https://gameland.com.ua/fihurka-frostpank-resursy-frostpunk-the-board-game-resources/
1386,1497491435,Фігурка Фростпанк: Дредноут (Frostpunk: The Board Game - Dreadnought Expansion),2092.0,True,https://gameland.com.ua/fihurka-frostpank-drednout-frostpunk-the-board-game-dreadnought-expansion/
1387,1497491437,Фростпанк: Дерев'яне місто (Frostpunk: The Board Game - Timber City),3688.0,True,https://gameland.com.ua/fihurka-frostpank-dereviane-misto-frostpunk-the-board-game-timber-city/
1388,1497491440,Жах Аркгема. Карткова гра – На краю землі. Дослідницьке доповнення (Arkham Horror: The Card Game – Edge of the Earth: Investigator Expansion),1599.0,True,https://gameland.com.ua/zhakh-arkhema.-kartkova-hra-na-kraiu-zemli.-doslidnytske-dopovnennia-arkham-horror-the-card-game-edge-of-the-earth-investigator-expansion/
1389,1497488867,Тераформування Марса. Експедиція Арес. Промо-карти (6 шт.),280.0,True,https://gameland.com.ua/teraformuvannya-marsa.-promo-karti-6-sht./
1390,1497491434,Фігурка Фростпанк: Мініатюри (Frostpunk: The Board Game - Miniatures),3688.0,True,https://gameland.com.ua/fihurka-frostpank-miniatiury-frostpunk-the-board-game-miniatures/
1391,1497488753,Загублені руїни Арнаку. Лідери експедицій (Lost Ruins of Arnak: Expedition Leaders),992.0,True,https://gameland.com.ua/zagubleni-ruini-arnaku.-lideri-ekspeditsiy/
1392,1497489852,Space Alert: The New Frontier,920.0,True,https://gameland.com.ua/space-alert-the-new-frontier/
1393,1497488173,Діксіт 6: Спогади (Dixit 6: Memories),636.0,True,https://gameland.com.ua/diksit-6-spogadi/
1394,1497489456,Ticket to Ride - Poland (Квиток на потяг: Польша),760.0,True,https://gameland.com.ua/ticket-to-ride-poland-kvytok-na-potiah-polsha/
1395,1497488102,Селестія: Більші Можливості (Celestia: A Little Help),304.0,True,https://gameland.com.ua/selestiya-ruka-dopomogi/
1396,1497488101,Селестія: Нові горизонти,384.0,True,https://gameland.com.ua/selestiya-bunt-na-korabli/
1397,1497489892,Concordia: Gallia / Corsica,544.0,True,https://gameland.com.ua/concordia-gallia-corsica/
1398,1497489893,Concordia Venus: Balearica / Italia,680.0,True,https://gameland.com.ua/concordia-venus-balearica-italia/
1399,1497489217,Круті Перці. Промонабір Вогняр,70.0,True,https://gameland.com.ua/kruti-pertsi.-promonabir-vohniar/
1400,1497489891,Concordia: Britannia / Germania,544.0,True,https://gameland.com.ua/concordia-britannia-germania/
1401,1497490284,Таверни Тіфенталя: До світанку! (The Taverns of Tiefenthal: Open Doors!),960.0,True,https://gameland.com.ua/taverny-tifentalia-do-svitanku-the-taverns-of-tiefenthal-open-doors/
1402,1497490142,King of Tokyo/New York: Monster Pack – King Kong,392.0,True,https://gameland.com.ua/king-of-tokyo-new-york-monster-pack-king-kong/
1403,1497488088,Підвищуй Градус,432.0,True,https://gameland.com.ua/pidvishchuy-gradus-ukr./
1404,1497489075,Уламки нескінченості. Релікти майбутнього (Shards of Infinity: Relics of the Future),424.0,True,https://gameland.com.ua/ulamki-neskinchenosti.-relikti-maybutnogo/
1405,1497489077,Качконіс (Platypus). Промонабір Рідненький,80.0,True,https://gameland.com.ua/kachkonis.-promonabir-ridnenkiy/
1406,1497489564,Last Will: Getting Sacked!,680.0,True,https://gameland.com.ua/last-will-getting-sacked/
1407,1497488087,Підвищуємо Градус (рос.),436.0,True,https://gameland.com.ua/pidvishchuiemo-gradus/
1408,1497489076,Качконіс (Platypus). Промонабір Молодіжний,80.0,True,https://gameland.com.ua/kachkonis.-promonabir-molodizhniy/
1409,1497489073,Круті Перці. Славні Хлопці,264.0,True,https://gameland.com.ua/kruti-pertsi.-slavni-khloptsi/
1410,1497487951,Жах Аркгема. Карткова гра: Спадщина Данвіча,596.0,True,https://gameland.com.ua/zhakh-arkgema.-kartkova-gra-spadshchina-danvicha-ukr./
1411,1497489906,Поклик Ктулху. Швидкий старт (Call of Cthulhu Quick-Start Rules),112.0,True,https://gameland.com.ua/poklyk-ktulkhu.-shvydkyi-start-call-of-cthulhu-quick-start-rules/
1412,1497489106,Острів котів: Набір кораблів (The Isle of Cats: Boat Pack),950.0,True,https://gameland.com.ua/ostriv-kotiv-nabir-korabliv/
1413,1497488767,Хто я? (велика),252.0,True,https://gameland.com.ua/khto-ya-velika/
1414,1497488989,Еротична гра для пар 1001 День,212.0,True,https://gameland.com.ua/gra-dlya-par-1001-den/
1415,1497489009,Wonders of the World (Чудеса Світу),556.0,True,https://gameland.com.ua/wonders-of-the-world-chudesa-svitu-angl./
1416,1497489080,Чекова книжка Секс бажань,221.0,True,https://gameland.com.ua/chekova-knizhka-seks-bazhan/
1417,1497489085,"Скретч карта України ""Travel Map Brave Ukraine""",352.0,True,https://gameland.com.ua/skretch-karta-ukraini-travel-map-brave-ukraine/
1418,1497489089,"Скретч карта світу ""Travel Map Geography World""",614.0,True,https://gameland.com.ua/skretch-karta-svitu-travel-map-geography-world/
1419,1497489090,"Скретч карта світу ""Travel Map Gold World""",396.0,True,https://gameland.com.ua/skretch-karta-svitu-travel-map-gold-world/
1420,1497489093,Скретч постер #100СПРАВ LOVE edition (рос.),490.0,True,https://gameland.com.ua/skretch-poster-100sprav-love-edition/
