,id,name,price,in_stock,link
0,1497488122,Nanty Narking. Великі сподівання,1320.0,True,https://gameland.com.ua/nanty-narking.-veliki-spodivannya-ukr./
1,1497490289,Битва Ресторанів (Rival Restaurants),1838.0,True,https://gameland.com.ua/bytva-restoraniv-rival-restaurants/
2,1497490961,Стамбул. Повне видання (Istanbul: Big Box),1960.0,True,https://gameland.com.ua/stambul.-povne-vydannia-istanbul-big-box/
3,1458100540,МікроМакро: Вбивче місто (MicroMacro: Crime City),960.0,True,https://gameland.com.ua/mikromakro-vbivche-misto-ukr./
4,1497491171,МікроМакро: Вбивче місто — Ва-банк (MicroMacro: Crime City – All In),900.0,True,https://gameland.com.ua/mikromakro-vbyvche-misto-va-bank-micromacro-crime-city-all-in/
5,1497489964,Вище суспільство (High Society),384.0,True,https://gameland.com.ua/vyshche-suspilstvo-high-society/
6,1497488675,Гра під замовлення,1.0,True,https://gameland.com.ua/nastilna-gra-pid-zamovlennya/
7,1497490163,Новий ковчег (Ark Nova),2559.0,True,https://gameland.com.ua/novyi-kovcheh-ark-nova/
8,1497491010,Гра престолів. Друге видання (A Game of Thrones: The Board Game Second Edition),2200.0,True,https://gameland.com.ua/hra-prestoliv.-druhe-vydannia-a-game-of-thrones-the-board-game-second-edition/
9,1497490435,Фростпанк (Frostpunk: The Board Game),5032.0,True,https://gameland.com.ua/frostpunk-the-board-game/
10,1497487989,Цей дивовижний світ (It's a Wonderful World),1456.0,True,https://gameland.com.ua/tsey-bozhevilniy-svit-its-a-wonderful-world-ukr./
11,1497489225,Битва за Дивокрай (Wonderland's War),2500.0,True,https://gameland.com.ua/wonderlands-war/
12,1497488009,Star Wars. Зовнішнє кільце (Star Wars Outer Rim),3160.0,True,https://gameland.com.ua/star-wars.-zovnishnie-kiltse-star-wars-outer-rim-ukr./
13,1497490254,Шериф Ноттінгема (Sheriff of Nottingham) ,1272.0,True,https://gameland.com.ua/sheryf-nottinhema-sheriff-of-nottingham/
14,1497488178,"Unmatched: Битва легенд. Частина перша (Unmatched: Battle of Legends, Volume One)",1575.0,True,https://gameland.com.ua/unmatched-bitva-legend.-chastina-persha/
15,1497488447,Сутінки імперії. Четверте видання (Twilight Imperium: Fourth Edition),5800.0,True,https://gameland.com.ua/sutinki-imperii.-chetverte-vidannya/
16,1497491217,Вороття до Темної Вежі (Return to Dark Tower),5712.0,True,https://gameland.com.ua/vorottia-do-temnoi-vezhi-return-to-dark-tower/
17,1497489706,Остання ніч: Перевертні (One Night Ultimate Werewolf),512.0,True,https://gameland.com.ua/ostannia-nich-perevertni-one-night-ultimate-werewolf/
18,1497488926,Під полум'ям небес (Under Falling Skies),960.0,True,https://gameland.com.ua/pid-polumyam-nebes/
19,1497490090,Нідавеллір (Nidavellir),1280.0,True,https://gameland.com.ua/nidavellir-nidavellir/3652/
20,1497489558,Deal with the Devil,2138.0,True,https://gameland.com.ua/deal-with-the-devil/
21,1497489592,"Проєкт ""Гая"" (Gaia Project)",3196.0,True,https://gameland.com.ua/gaia-project-proekt-haiia/
22,1497488438,Розкіш Marvel (Splendor Marvel),1272.0,True,https://gameland.com.ua/rozkish-marvel/
23,1497489652,Great Western Trail: Argentina,2120.0,True,https://gameland.com.ua/great-western-trail-argentina/
24,1497490087,Лють крові (Blood Rage) ,3024.0,True,https://gameland.com.ua/lіut-krovi-blood-rage/
25,1497489228,Акрополіс (Akropolis),960.0,True,https://gameland.com.ua/akropolis/
26,1497491641,Край Андромеди (Andromeda's Edge),3150.0,True,https://gameland.com.ua/krai-andromedy-andromedas-edge/
27,1497490522,Кримінальні хроніки: 1400 (Chronicles of Crime: 1400),959.0,True,https://gameland.com.ua/kryminalni-khroniky-1400-chronicles-of-crime-1400/
28,1497488832,Маєтки божевілля (Mansions of Madness Second Edition),3822.0,True,https://gameland.com.ua/mansions-of-madness-second-edition/
29,1497489737,Війна Персня. Карткова гра (War of the Ring: The Card Game),1400.0,True,https://gameland.com.ua/viina-persnia.-kartkova-hra-war-of-the-ring-the-card-game-peredzamovlennia/
30,1497491314,Орлеан (Orleans),1592.0,True,https://gameland.com.ua/orlean-orlean/
31,1497491458,ISS Vanguard,8495.0,True,https://gameland.com.ua/iss-vanguard/
32,1497491315,Cyberpunk 2077. Банди Найт-Сіті (Gangs of Night City),3680.0,True,https://gameland.com.ua/cyberpunk-2077.-bandy-nait-siti-gangs-of-night-city/
33,1497491390,Гегемонія (Hegemony: Lead Your Class to Victory),3679.0,True,https://gameland.com.ua/hehemoniia-hegemony-lead-your-class-to-victory/
34,1497490213,Сяйво (Glow) ,1276.0,True,https://gameland.com.ua/siaivo-glow/
35,1497489604,Петля (The Loop),1592.0,True,https://gameland.com.ua/petlia-the-loop/
36,1497491011,Дюна: Імперіум - Піднесення (Dune: Imperium – Uprising),2310.0,True,https://gameland.com.ua/diuna-imperium-pidnesennia-dune-imperium-uprising/
37,1497489173,Порт-Роял. Повне видання (Port Royal: Big Box),872.0,True,https://gameland.com.ua/port-royal.-povne-vidannya/
38,1497490127,Пуерто-Ріко 1897,2230.0,True,https://gameland.com.ua/puerto-rico-1897/
39,1497488834,Merchants of the Dark Road,2394.0,True,https://gameland.com.ua/merchants-of-the-dark-road/
40,1497491392,Кіклади. Легендарне видання (Cyclades: Legendary Edition),2478.0,True,https://gameland.com.ua/kiklady.-lehendarne-vydannia-cyclades-legendary-edition/
41,1497491662,Ready Set Bet,1924.0,True,https://gameland.com.ua/ready-set-bet/
42,1497491664,Arkham Horror: Lovecraft Letter,882.0,True,https://gameland.com.ua/arkham-horror-lovecraft-letter/
43,1345862381,Острів Духів (Spirit Island),2923.0,True,https://gameland.com.ua/ostriv-dukhiv-spirit-island/
44,1497491430,Володар Перснів. Дуель за Середземʼя (The Lord of the Rings: Duel for Middle-earth),1168.0,True,https://gameland.com.ua/volodar-persniv.-duel-za-seredzemia-the-lord-of-the-rings-duel-for-middle-earth/
45,1497488342,Marvel Champions. Карткова гра (Чемпіони Марвел),1952.0,True,https://gameland.com.ua/marvel-champions.-kartkova-gra-ukr./
46,1497489796,Турбо: Спека на треку (Heat: Pedal to the metal),2224.0,True,https://gameland.com.ua/turbo-speka-na-treku-heat-pedal-to-the-metal/
47,1497490853,Призначення (Destinies),1800.0,True,https://gameland.com.ua/pryznachennia-destinies/
48,1497488128,Війна Персня. Друге видання (War of the Ring),3112.0,True,https://gameland.com.ua/viyna-persnya.-druge-vidannya-ukr./
49,1497490015,Експедиції (Expeditions) ,2600.0,True,https://gameland.com.ua/ekspedytsii-expeditions/
50,1497491640,Хрещений батько. Імперія Корлеоне (The Godfather: Corleone's Empire),2932.0,True,https://gameland.com.ua/khreshchenyi-batko.-imperiia-korleone-the-godfather-corleones-empire/
51,1497489346,Кодові імена: Малюнки (Codenames: Pictures),760.0,True,https://gameland.com.ua/kodovi-imena-malіunky-codenames-pictures/
52,1497488343,Містична Долина (Mystic Vale),1360.0,True,https://gameland.com.ua/mistichna-dolina-ukr./
53,1459485693,Кодові імена: гра слів (Codenames),760.0,True,https://gameland.com.ua/kodovi-imena-gra-sliv-codenames-ukr./
54,1497487960,Кемет: Кров і пісок (Kemet: Blood and Sand) (укр./рос.),2680.0,True,https://gameland.com.ua/kemet-krov-i-pisok-kemet-blood-and-sand/
55,1497490059,Ходу героям нема! (Keep the Heroes Out!),1676.0,True,https://gameland.com.ua/khodu-heroiam-nema-keep-the-heroes-out/
56,1497490089,Палео (Paleo),1760.0,True,https://gameland.com.ua/paleo-paleo/
57,1477899384,Бандероль MEGA (Передплата на 1 місяць) ,3600.0,True,https://gameland.com.ua/mystery-box/
58,1497490646,Бандероль LIGHT (Передплата на 1 місяць),2400.0,True,https://gameland.com.ua/mystery-box/1343/4200/
59,1497490647,Бандероль LIGHT (Передплата на 3 місяці),7200.0,True,https://gameland.com.ua/copy_banderol-z-nastolkamy-light-peredplata-na-1-misiats/
60,1497490883,Століття. Великий набір (Century: Big Box),2636.0,True,https://gameland.com.ua/stolittia.-velykyi-nabir-century-big-box/
61,1497490521,Ктулху: Смерть може вмерти (Cthulhu: Death May Die),3320.0,True,https://gameland.com.ua/ktulkhu-smert-mozhe-pomerty-cthulhu-death-may-die/
62,R020UA,Зима Мерців: Гра перехресть (Dead of Winter: A Crossroads Game),2596.0,True,https://gameland.com.ua/zyma-mertsiv-hra-perekhrest-dead-of-winter-a-crossroads-game/
63,1497490337,Темна Гавань. Щелепи Лева (Gloomhaven Jaws of the Lion) ,2360.0,True,https://gameland.com.ua/temna-havan.-shchelepy-leva-gloomhaven-jaws-of-the-lion/
64,1436949183,Euphoria: Build a Better Dystopia (Ейфорія: Побудуй кращу антиутопію),2920.0,True,https://gameland.com.ua/euphoria-build-a-better-dystopia-angl./
65,1497490004,Камера! Мотор! Гра про Кіновиробництво (Roll Camera!: The Filmmaking),1560.0,True,https://gameland.com.ua/kamera-motor-hra-pro-kinovyrobnytstvo-roll-camera-the-filmmaking/
66,1497488919,Кінець віків (Aeon’s End),1480.0,True,https://gameland.com.ua/aeons-end-2nd-edition/
67,1497488980,Лісовий затишок (Creature Comforts),1480.0,True,https://gameland.com.ua/lisoviy-zatishok/
68,1497490442,Парк собак (Dog Park) ,1832.0,True,https://gameland.com.ua/park-sobak-dog-park/
69,1497490214,Зграя (The Wolves) ,1560.0,True,https://gameland.com.ua/zghraia-the-wolves/
70,1497490076,"Camel Up: Off Season (Верблюди, вперед! У міжсезонні)",1416.0,True,https://gameland.com.ua/camel-up-off-season-verblіudy-vpered-u-mizhsezonni/
71,1497491384,Apiary,3234.0,True,https://gameland.com.ua/apiary/
72,1497490859,Детектив. Сучасне розслідування (Detective: A Modern Crime Board Game),1640.0,True,https://gameland.com.ua/detektyv.-suchasne-rozsliduvannia-detective-a-modern-crime-board-game/
73,1440806138,Дюна: Імперіум (Dune: Imperium) ,2120.0,True,https://gameland.com.ua/duna-imperium-dune-imperium-ukr./
74,1497489268,Таємні лідери (Hidden Leaders),680.0,True,https://gameland.com.ua/taiemni-lidery-hidden-leaders/
75,1497490058,Остання місія (Quest),624.0,True,https://gameland.com.ua/ostannia-misiia-quest/
76,1497490759,Парк водоспадів (Waterfall Park),1576.0,True,https://gameland.com.ua/park-vodospadiv-waterfall-park/
77,1497489569,King of Monster Island,1759.0,True,https://gameland.com.ua/king-of-monster-island/
78,1497489443,Пандемія Спадщина: Сезон 1 (Pandemic: Legacy - Season 1),2844.0,True,https://gameland.com.ua/pandemic-legacy-season-1-red-version/
79,1497490123,Голод (The Hunger),1592.0,True,https://gameland.com.ua/holod-the-hunger/
80,1497489327,Boonlake,2640.0,True,https://gameland.com.ua/boonlake/
81,14974889121,Безодня (Abyss),1596.0,True,https://gameland.com.ua/bezodnia-abyss-ua/
82,1497489813,Дорфромантік - Фермерськи Пригоди,1560.0,True,https://gameland.com.ua/dorfromantik-the-board-game/
83,1497490731,Алхіміки (Alchemists),1572.0,True,https://gameland.com.ua/alkhimiky-alchemists/
84,1497490523,Паперові Океани (Sea Salt & Paper),396.0,True,https://gameland.com.ua/paperovi-okeany-sea-salt-paper/
85,GKCH186dw,Дюна. Війна за Арракіс (Dune: War for Arrakis),4640.0,True,https://gameland.com.ua/diuna.-viina-za-arrakis-dune-war-for-arrakis/
86,1497490513,Тілетум (Tiletum),1996.0,True,https://gameland.com.ua/tyletum-tiletum/
87,1497490868,Декодер. Ювілейне видання (Decrypto),716.0,True,https://gameland.com.ua/dekoder.-yuvileine-vydannia-decrypto/
88,1497490865,Земля (Earth),1680.0,True,https://gameland.com.ua/zemlia-earth/
89,1497491369,Ера інновацій (Age of Innovation),3196.0,True,https://gameland.com.ua/era-innovatsii-age-of-innovation/
90,1497490403,Нортґард. Незвідані землі (Northgard: Uncharted Lands),2360.0,True,https://gameland.com.ua/nortgard.-nezvidani-zemli-northgard-uncharted-lands/
91,1478650134,Пройдисвіти Кведлінбурга (The Quacks of Quedlinburg),1356.0,True,https://gameland.com.ua/proydisviti-z-kvedlinburga-the-quacks-of-quedlinburg-ukr./
92,1497491609,Сплячі Боги. Далекі небеса. Колекційне видання (Sleeping Gods: Distant Skies),4275.0,True,https://gameland.com.ua/spliachi-bohy.-daleki-nebesa.-kolektsiine-vydannia-sleeping-gods-distant-skies/
93,1483678646,Зомбіцид. Друга редакція (Zombicide: 2nd Edition),3680.0,True,https://gameland.com.ua/zombitsid.-druga-redaktsiya/
94,1497491267,Йокогама (Yokohama),1996.0,True,https://gameland.com.ua/yokohama-yokohama/
95,1497491661,Stardew Valley: The Board Game,3158.0,True,https://gameland.com.ua/stardew-valley-the-board-game/
96,1497491665,Last Light,2772.0,True,https://gameland.com.ua/last-light/
97,1497490704,Вранішнє сонце (Rising Sun),3356.0,True,https://gameland.com.ua/vranishnie-sontse-rising-sun/
98,1497490793,Легенди Дикого Заходу (Western Legends),2392.0,True,https://gameland.com.ua/lehendy-dykoho-zakhodu-western-legends/
99,1497488141,Такеноко. Ювілейне видання (Takenoko),1560.0,True,https://gameland.com.ua/takenoko.-uvileyne-vidannya-ukr./
100,1497490915,Космобійники (Galaxy Trucker),1264.0,True,https://gameland.com.ua/kosmobiinyky-galaxy-trucker/
101,1497491632,Ктулху. Смерть може вмерти. Страх перед незвіданим (Cthulhu: Death May Die - Fear of the Unknown),4499.0,True,https://gameland.com.ua/ktulkhu.-smert-mozhe-vmerty.-strakh-pered-nezvidanym-cthulhu-death-may-die-fear-of-the-unknown/
102,1497489970,Вогнетвір (Flamecraft),1436.0,True,https://gameland.com.ua/vohnetvir-flamecraft/
103,1497489435,Cosmic Encounter,2850.0,True,https://gameland.com.ua/cosmic-encounter/
104,1497490485,Космічний контакт (Cosmic Encounter: 42nd Anniversary Edition) ,2116.0,True,https://gameland.com.ua/kosmichnyi-kontakt-cosmic-encounter/
105,1497488701,Селестія (Celestia),880.0,True,https://gameland.com.ua/selestiya/
106,1497490625,Terra Mystica: Big Box,5240.0,True,https://gameland.com.ua/terra-mystica-big-box/
107,GKCH194cv,Цивілізація. Новий світанок (Civilization: A New Dawn),2120.0,True,https://gameland.com.ua/civilization-a-new-dawn-angl./
108,1497488065,Замки Бургундії. Українське видання (The Castles of Burgundy),1784.0,True,https://gameland.com.ua/zamki-burgundii.-ukrainske-vidannya/
109,1497490272,Прадавні історії (Prehistories),836.0,True,https://gameland.com.ua/pradavni-istorii-prehistories/
110,1497490643,Книга магії (Spellbook),1196.0,True,https://gameland.com.ua/knyha-mahii-spellbook/
111,1497490904,"Camel Up (Second Edition) (Верблюди, вперед 2.0)",1439.0,True,https://gameland.com.ua/camel-up-second-edition-verbliudy-vpered-2.0/
112,1497489237,Евердел (Everdell),2200.0,True,https://gameland.com.ua/everdell/
113,1497487941,Анкх. Боги Єгипту (Ankh: Gods of Egypt),3440.0,True,https://gameland.com.ua/ankkh.-bogi-iegiptu-ankh-gods-of-egypt-ukr./
114,1497491557,SETI: Пошуки позаземного життя,2705.0,True,https://gameland.com.ua/seti-poshuky-pozazemnoho-zhyttia/
115,1497490595,First Rat,1759.0,True,https://gameland.com.ua/first-rat/
116,1497490124,Гікорі Дікорі (Hickory Dickory),1880.0,True,https://gameland.com.ua/hikori-dikori-hickory-dickory/
117,1497491013,Знак Старших богів (Elder Sign),1480.0,True,https://gameland.com.ua/znak-starshykh-bohiv-elder-sign/
118,1497489227,Істота. Настільна гра (The Thing: The Boardgame),1800.0,True,https://gameland.com.ua/the-thing-the-boardgame/
119,1497490587,Зоряні війни: Повстання (Star Wars: Rebellion),3680.0,True,https://gameland.com.ua/star-wars-rebellion-zoriani-viiny-povstannia/
120,1497489883,Woodcraft,2065.0,True,https://gameland.com.ua/woodcraft/
121,1497491150,Білий замок (The White Castle),1000.0,True,https://gameland.com.ua/bilyi-zamok-the-white-castle/
122,1345717552,Жах Аркгема: Карткова гра – Оновлене видання (Arkham Horror LCG: Revised Core Set),2156.0,True,https://gameland.com.ua/zhakh-arkgemu.-kartkova-gra-arkham-horror-the-card-game-ukr./
123,1497487938,П'ять каст (Five Tribes),2040.0,True,https://gameland.com.ua/pyat-kast-five-tribes-ukr./
124,1497489516,Roll Player (Шлях Героя),2080.0,True,https://gameland.com.ua/roll-player-shliakh-heroia/
125,1497488061,Крила (Wingspan),2076.0,True,https://gameland.com.ua/krila-wingspan-ukr./
126,1497489369,Каркасон. Нове видання (Carcassonne),1008.0,True,https://gameland.com.ua/karkason.-nove-vydannia-carcassonne/
127,1497489818,Western Empires,3720.0,True,https://gameland.com.ua/western-empires/
128,1497490316,Чотири темпераменти. Делюкс видання (Four Humours),1840.0,True,https://gameland.com.ua/chotyry-temperamenty.-deliuks-vydannia-four-humours/
129,1497491659,Володар Перснів. Доля братства (The Lord of the Rings: Fate of the Fellowship),2950.0,True,https://gameland.com.ua/volodar-persniv.-dolia-bratstva-the-lord-of-the-rings-fate-of-the-fellowship/5218/
130,1497490651,Верхогони (Long Shot: The Dice Game),872.0,True,https://gameland.com.ua/verkhohony-long-shot-the-dice-game/
131,1497488070,Азул (Azul),1420.0,True,https://gameland.com.ua/azul-azul-ukr./
132,1497491325,Хутко в друк (Fit to Print),1399.0,True,https://gameland.com.ua/khutko-v-druk-fit-to-print/
133,1497490652,Ікі (IKI),2000.0,True,https://gameland.com.ua/iki-iki/
134,1497488622,Кольт Експрес (Colt Express),1240.0,True,https://gameland.com.ua/kolt-ekspres/
135,1497490445,"Гранд-готель ""Австрія"" (Grand Austria Hotel) ",1920.0,True,https://gameland.com.ua/hrand-hotel-avstriia-grand-austria-hotel/
136,1497491416,Kelp: Акула проти Восьминога (Kelp: Shark vs Octopus) ,1676.0,True,https://gameland.com.ua/kelp-akula-proty-vosmynoha-kelp-shark-vs-octopus/
137,1497488344,Адріанів Вал (Hadrian's Wall),1104.0,True,https://gameland.com.ua/adrianiv-val-hadrians-wall/
138,1497488920,Concordia (Конкордія),1720.0,True,https://gameland.com.ua/concordia/
139,1497489764,Капітан Сонар (Captain Sonar),1520.0,True,https://gameland.com.ua/kapitan-sonar/
140,1497489211,Mage Wars Arena - Core Set,2240.0,True,https://gameland.com.ua/mage-wars-arena-core-set-angl./
141,1497489909,Hellboy: The Board Game (Геллбой),2864.0,True,https://gameland.com.ua/hellboy-the-board-game-hellboi/
142,1497491018,BULLET. Головоломний шутер (Bullet Star),1160.0,True,https://gameland.com.ua/bullet.-holovolomnyi-shuter-bullet-star/
143,1497489428,Нескінченна зима. Палеоамериканці (Endless Winter: Paleoamericans),2236.0,True,https://gameland.com.ua/neskinchenna-zyma.-paleoamerykantsi-endless-winter-paleoamericans/
144,1345717514,Містеріум (Mysterium),952.0,True,https://gameland.com.ua/mysterium-igra/
145,1497490709,Майстерня (Woodcraft),1759.0,True,https://gameland.com.ua/maisternia-woodcraft/
146,1497489849,Knight Tales,2440.0,True,https://gameland.com.ua/knight-tales/
147,1497487974,Паладини Західного Королівства (Paladins of the West Kingdom),1344.0,True,https://gameland.com.ua/paladini-zakhidnogo-korolivstva-ukr./
148,1497490645,Сенджюцу. Битва за Японію (Senjutsu: Battle For Japan),1560.0,True,https://gameland.com.ua/strategii/4199/
149,1497491304,Міцелія (Mycelia),1764.0,True,https://gameland.com.ua/mitseliia-mycelia/
150,1345862490,Квиток на поїзд: Європа (Ticket to Ride: Europe),1890.0,True,https://gameland.com.ua/kvitok-na-poizd-ievropa-ticket-to-ride-europe/
151,1497490857,Зоряні війни. Колодобудівна гра (Star Wars: The Deckbuilding Game),1360.0,True,https://gameland.com.ua/zoriani-viiny.-kolodobudivna-hra-star-wars-the-deckbuilding-game/
152,1497489029,Арборетум (Arboretum),392.0,True,https://gameland.com.ua/arboretum-angl./
153,1497489793,Таємниці замку Карак (Karak),1480.0,True,https://gameland.com.ua/taiemnytsi-zamku-karak-karak/
154,1345863846,Діксіт (Dixit),1196.0,True,https://gameland.com.ua/diksit-dixit/
155,1426647749,Одним словом (Just One),628.0,True,https://gameland.com.ua/odnim-slovom-just-one-ukrainskou/
156,1497491286,The Search for Planet X (У пошуках планети X),2100.0,True,https://gameland.com.ua/the-search-for-planet-x-poshuky-planety-x/4840/
157,1497489955,Відбудуй Україну,3040.0,True,https://gameland.com.ua/vidbudui-ukrainu/
158,1497490515,Королівство кроликів (Bunny Kingdom),1720.0,True,https://gameland.com.ua/korolivstvo-krolykiv-bunny-kingdom/
159,1497489827,The Quest for El Dorado: The Golden Temples,1080.0,True,https://gameland.com.ua/the-quest-for-el-dorado-the-golden-temples/
160,1497489787,Ольтре (Oltréé),2240.0,True,https://gameland.com.ua/oltre-oltree/
161,1497487988,Саґрада (Sagrada),1560.0,True,https://gameland.com.ua/sagrada-sagrada-ukr./
162,1497489574,Gutenberg,1880.0,True,https://gameland.com.ua/gutenberg/
163,1497490596,Trepanation,1280.0,True,https://gameland.com.ua/trepanation/
164,1497490804,Ticket to Ride: Legends of the West,4000.0,True,https://gameland.com.ua/ticket-to-ride-legends-of-the-west/
165,1497490297,Відьомська Круговерть (Whirling Witchcraft) ,1024.0,True,https://gameland.com.ua/vidomska-kruhovert-whirling-witchcraft/
166,1497490290,Слідами Дарвіна (In the Footsteps of Darwin),1480.0,True,https://gameland.com.ua/in-the-footsteps-of-darwin/
167,1497490780,Snap Ships Tactics,2720.0,True,https://gameland.com.ua/snap-ships-tactics/
168,1497491666,Raccoon Tycoon,2016.0,True,https://gameland.com.ua/raccoon-tycoon/
169,1497490583,Хижі Світи (Wild Space),792.0,True,https://gameland.com.ua/khyzhi-svity-wild-space/
170,1497490880,Століття. Дорога прянощів (Century: Spice Road),1116.0,True,https://gameland.com.ua/stolittia.-doroha-prianoshchiv-century-spice-road/
171,1497491276,MLEM. Космічне агентство (MLEM: Space Agency),1056.0,True,https://gameland.com.ua/mlem.-kosmichne-ahentstvo-mlem-space-agency/
172,1497491012,Пори року (Seasons),1680.0,True,https://gameland.com.ua/pory-roku-seasons/
173,1497488428,Great Western Trail (2nd Edition) (Великий Західний шлях 2-ге видання),1836.0,True,https://gameland.com.ua/great-western-trail-2nd-edition/
174,1497491443,Селестія. Повне видання (Celestia: Big Box),1800.0,True,https://gameland.com.ua/selestiia.-povne-vydannia-celestia-big-box/
175,1497490761,ЕльГранде 2.0 (ElGrande 2.0),1560.0,True,https://gameland.com.ua/elhrande-2.0-elgrande-2.0/
176,1497490608,Oak,2224.0,True,https://gameland.com.ua/oak/
177,1497490441,Володар Перснів. Карткова гра (The Lord of the Rings: The Card Game),2156.0,True,https://gameland.com.ua/volodar-persniv.-kartkova-hra-the-lord-of-the-rings-the-card-game/
178,1497490974,Космоспрут (Cosmoctopus),1216.0,True,https://gameland.com.ua/kosmosprut-cosmoctopus/
179,1497489708,Азул: Майстер Шоколатьє (Azul: Master Chocolatier),1592.0,True,https://gameland.com.ua/azul-maister-shokolatie-azul-master-chocolatier/
180,1497491232,Сучасне мистецтво (Modern Art),1040.0,True,https://gameland.com.ua/suchasne-mystetstvo-modern-art/
181,1497491347,Змієвир (Wyrmspan),2079.0,True,https://gameland.com.ua/zmiievyr-wyrmspan/
182,1497488445,Keyflower (укр.),1360.0,True,https://gameland.com.ua/keyflower-ukr./
183,1497490916,Кіт у коробці (Cat in the Box: Deluxe Edition),956.0,True,https://gameland.com.ua/kit-u-korobtsi-cat-in-the-box-deluxe-edition/
184,1442116353,Вершники Скіфії (Raiders of Scythia),1280.0,True,https://gameland.com.ua/vershniki-skifii-raiders-of-scythia-ukr./
185,1497490952,Машина Тюрінга (Turing Machine),1360.0,True,https://gameland.com.ua/mashyna-tiurinha-turing-machine/
186,1425412250,Bonfire (Багаття),2000.0,True,https://gameland.com.ua/bonfire-angl./
187,1497489766,Pandemic Legacy: Season 2 (Пандемія: Спадок - Другий сезон)(Black),3480.0,True,https://gameland.com.ua/pandemic-legacy-season-2-pandemiia-spadok-druhyi-sezon/3326/
188,1497489765,Pandemic Legacy: Season 2 (Пандемія: Спадок - Другий сезон)(Yellow),3480.0,True,https://gameland.com.ua/pandemic-legacy-season-2-pandemiia-spadok-druhyi-sezon/
189,1497489734,Авалон (Avalon Нова версія),608.0,True,https://gameland.com.ua/avalon-avalon-klasychna-versiia/
