id,name,price,in_stock,link
igrm017,Dixit 10: Mirrors (Діксіт 10: Дзеркала),799.0,True,https://geekach.com.ua/dixit-10-mirrors-diksit-10-zerkala/
igrm036,Rurik. Камінь та лезо,747.0,True,https://geekach.com.ua/rurik.-kamin-ta-lezo/
igrm135,Жах Аркгема. Карткова гра – На краю світу. Дослідницьке доповнення,1999.0,True,https://geekach.com.ua/zhakh-arkhema.-kartkova-hra-na-kraiu-svitu.-doslidnytske-dopovnennia/
igrm134,Жах Аркгема. Карткова гра – На краю світу. Путівник по кампанії,3099.0,True,https://geekach.com.ua/zhakh-arkhema.-kartkova-hra-na-kraiu-svitu.-putivnyk-po-kampanii/
LOB2346UA,Маленький світ (Small World),2500.0,True,https://geekach.com.ua/small-world-malenkiy-mir/
LOB2412UA,Печворк. Український фольклор (Patchwork),980.0,True,https://geekach.com.ua/pechvork.-ukrainskyi-folklor-patchwork/
LOB2317UA,Мишачі Оповідки (Mice and Mystics),3110.0,True,https://geekach.com.ua/pro-myshei-i-taiemnytsi-mice-and-mystics/
R020UA,Зима Мерців: Гра перехресть (Dead of Winter: A Crossroads Game),3249.0,True,https://geekach.com.ua/zyma-mertsiv-hra-perekhrest-dead-of-winter-a-crossroads-game/
R016UA,Вранішнє сонце (Rising Sun),4199.0,True,https://geekach.com.ua/vranishnie-sontse-rising-sun/
LOB2316UA,Алхіміки (Alchemists),1965.0,True,https://geekach.com.ua/alkhimiky-alchemists/
57059,Токайдо (Tokaido),1799.0,True,https://geekach.com.ua/tokaido-tokaydo/
POL0047,7 Wonders: Armada (7 Чудес: Армада) Англ,1399.0,True,https://geekach.com.ua/7-wonders-armada-7-chudes-armada-anhl/
POL0056,7 Wonders: Leaders (7 Чудес: Лідери) Англ,1199.0,True,https://geekach.com.ua/7-wonders-leaders-7-chudes-lidery-anhl/
SCJAI01UA,Джайпур (Jaipur),900.0,True,https://geekach.com.ua/dzhaypur-ukr-jaipur/
igrm028,Пандемія. На межі (Pandemic: On the Brink),1249.0,True,https://geekach.com.ua/pandemiya.-na-mezhi-pandemic-on-the-brink/
igrm030,7 Чудес: Міста / 7 Wonders: Cities,949.0,True,https://geekach.com.ua/7-chudes-mista-7-wonders-cities/
LOB2333UA,Квиток на потяг - Рейки та вітрила (Ticket to Ride - Rails & Sails),3640.0,True,https://geekach.com.ua/ticket-to-ride-rails-sails-kvitok-na-poizd-reyki-ta-vitrila/
LOB2219UA,Квиток на поїзд: Європа (Ticket to Ride. Europe),2250.0,True,https://geekach.com.ua/kvytok-na-poizd-yevropa-ticket-to-ride.-europe/
R011UA,Битва за Дивокрай (Wonderland's War),3129.0,True,https://geekach.com.ua/bytva-za-dyvokrai-wonderlands-war/
TTR_WL,Ticket to Ride: Legends of the West,5100.0,True,https://geekach.com.ua/ticket-to-ride-legacy-legends-of-the-west/
LOB2309UA,"Гранд-готель ""Австрія"" (Grand Austria Hotel)",2500.0,True,https://geekach.com.ua/hrand-hotel-avstriia-grand-austria-hotel/
LOB2305UA,Каскадія (Cascadia),1750.0,True,https://geekach.com.ua/kaskadiia-cascadia/
igrm100,Крила. Фан Арт Пак (Wingspan: Fan Art Pack),949.0,True,https://geekach.com.ua/kryla.-fan-art-pak-wingspan-fan-art-pack/
R100UA,CATAN. Настільна гра (Settlers of Catan),1990.0,True,https://geekach.com.ua/catan.-nastilna-hra-settlers-of-catan/
LOB2117UA,Кольт Експрес (Colt Express),1550.0,True,https://geekach.com.ua/kolt-ekspress-colt-express-ukr/
R038UA,Вибухові кошенята 18+: Видання для дорослих (Exploding Kittens: NSFW),999.0,True,https://geekach.com.ua/vybukhovi-kosheniata-18-vydannia-dlia-doroslykh-exploding-kittens-nsfw/
LORD001,KLASK / КЛАСК,2785.0,True,https://geekach.com.ua/klask-klask/
LOB2002UK,Вершники Скіфії (Raiders of Scythia),1610.0,True,https://geekach.com.ua/vershniki-skifii-raiders-of-scythia/
LOB2111UA,П'ять Каст (Five Tribes),2570.0,True,https://geekach.com.ua/pyat-kast-five-tribes/
LOB2104UA,Каліко (Calico),1690.0,True,https://geekach.com.ua/kaliko-calico-ukr/
LOB2106UA,Відважні. Нормандія (Undaunted: Normandy),1150.0,True,https://geekach.com.ua/neustrashimye.-normandiya-ukr-undaunted-normandy/
LOB2109UA,Листи закоханих (Love Letter),530.0,True,https://geekach.com.ua/listi-zakokhanikh-love-letters/
LOB2115UA,Паладини Західного Королівства (Paladins of the West Kingdom),1690.0,True,https://geekach.com.ua/paladini-zakhidnogo-korolivstva-paladins-of-the-west-kingdom/
LOB2122UA,Зоряні війни: Палац Джабби - Листи Закоханих (Star Wars: Jabba's Palace),570.0,True,https://geekach.com.ua/zoryani-viyni-palats-dzhabbi-listi-zakokhanikh-star-wars-jabbas-palace/
OTH0096,Правда або дія: Для двох,420.0,True,https://geekach.com.ua/pravda-abo-diya-dlya-dvokh-ukr/
OTH0095,Правда або дія: Для двох (російською),272.0,True,https://geekach.com.ua/pravda-ili-delo-dlya-dvoikh/
LOB2202UA,Курочки (Hens),510.0,True,https://geekach.com.ua/kurochki-hens/
LOB2114UA,Порт-Роял. Повне видання + промонабір (Port Royal: Big Box),1090.0,True,https://geekach.com.ua/port-royal.-povne-vidannya-promonabir-port-royal-big-box/
R001UA,Концепт (Concept),1499.0,True,https://geekach.com.ua/kontsept-concept/
rozum013,Паранормальні детективи (Paranormal Detectives),1499.0,True,https://geekach.com.ua/paranormalni-detektyvy-paranormal-detectives/
R032UA,Майстерня (Woodcraft),2199.0,True,https://geekach.com.ua/maisternia-woodcraft/
LOB2328UA,Мандрівки віхами історії (Trekking Through History),1800.0,True,https://geekach.com.ua/trekking-through-history/
R034UA,Хроніки замку Авель (Chronicles of Avel),1699.0,True,https://geekach.com.ua/chronicles-of-avel/
igrmstr03,Магічні Вежі (Wandering Towers),1950.0,True,https://geekach.com.ua/mahichni-vezhi-wandering-towers/
igrm090,Цинічні Історії (Joking Hazard),849.0,True,https://geekach.com.ua/tsynichni-istorii-joking-hazard/
R045UA,Мавка: Між двома світами,1439.0,True,https://geekach.com.ua/mavka-mizh-dvoma-svitamy/
R044UA,Мавка: Магічна Верба,809.0,True,https://geekach.com.ua/mavka-mahichna-verba/
igrm092,Окуляри віртуальної реальності для гри Кримінальні хроніки,590.0,True,https://geekach.com.ua/okuliary-virtualnoi-realnosti-dlia-hry-kryminalni-khroniky/
R036UA,Котобол (A Game of Cat & Mouth),1399.0,True,https://geekach.com.ua/kotobol-a-game-of-cat-mouth/
SFDS-RPG029,Dark Souls RPG: Game Master's Screen,2100.0,True,https://geekach.com.ua/dark-souls-rpg-game-masters-screen/
R055UA,Вибухові кошенята: Добро і Зло (Exploding Kittens: Good Vs Evil),1019.0,True,https://geekach.com.ua/vybukhovi-kosheniata-dobro-i-zlo-exploding-kittens-good-vs-evil/
pdrgngs05,Escape from New York: Heroes set + Prisoners,1000.0,True,https://geekach.com.ua/escape-from-new-york-heroes-set-prisoners/
fungeek02,Ігровий килимок для настільної гри Фростпанк,2490.0,True,https://geekach.com.ua/ihrovyi-kylymok-dlia-nastilnoi-hry-frostpank/
hdknm03,Нетворкінг (Networking),895.0,True,https://geekach.com.ua/netvorkinh-networking/
R091UA,Конотопська відьма,949.0,True,https://geekach.com.ua/konotopska-vidma/
R099UA,Хто Зверху?,999.0,True,https://geekach.com.ua/khto-zverkhu/
LOB2112UA,Адріанів Вал (Hadrian's Wall),1380.0,True,https://geekach.com.ua/adrianiv-val-hadrians-wall/
igrm035,Нескінченна зима. Палеоамериканці - Пращури,979.0,True,https://geekach.com.ua/neskinchenna-zima.-paleoamerikantsi-prashchuri/
igrm082,Endless Winter: Rivers & Rafts Expansion (Нескінченна Зима: Річки та Човни),1185.0,True,https://geekach.com.ua/endless-winter-rivers-rafts-expansion-neskinchenna-zyma-richky-ta-chovny/
igrm083,Endless Winter: Cave Paintings Expansion (Нескінченна Зима: Печерні Малюнки),1185.0,True,https://geekach.com.ua/endless-winter-cave-paintings-expansion-neskinchenna-zyma-pecherni-maliunky/
igrm084,Endless Winter: Aurora Borealis (Нескінченна Зима: Північне Сяйво),255.0,True,https://geekach.com.ua/endless-winter-aurora-borealis-neskinchenna-zyma-pivnichne-siaivo/
igrm085,Нескінченна Зима: Мамут (Endless Winter: Mammoth Module),350.0,True,https://geekach.com.ua/neskinchenna-zyma-mamut-endless-winter-mammoth-module/
igrm087,Endless Winter: Ceremonial Grounds (Нескінченна Зима: Священні Землі),255.0,True,https://geekach.com.ua/endless-winter-ceremonial-grounds-neskinchenna-zyma-sviashchenni-zemli/
R059UA,Наші міста: Мачі Коро 2 (Machi Koro 2),1199.0,True,https://geekach.com.ua/nashi-mista-machi-koro-2/
LOB2210UA,Капітани Зорельотів (Starship Captains),2360.0,True,https://geekach.com.ua/kapitany-zorelotiv-starship-captains/
R027UA,Зоопарк Нью-Йорка (New York Zoo),1156.0,True,https://geekach.com.ua/zoopark-niu-iorka-new-york-zoo/
POL0087,Project L українською,1365.0,True,https://geekach.com.ua/project-l-pl/
LOB2211UA,Голоси в моїй голові (Voices In My Head),1540.0,True,https://geekach.com.ua/holosy-v-moii-holovi-voices-in-my-head/
LOB2213UA,Брудні Гроші (Dirty Money: The Money Laundering Game),890.0,True,https://geekach.com.ua/brudni-hroshi-dirty-money-the-money-laundering-game/
LOB2302UA,Таємниці замку Карак (Karak),1850.0,True,https://geekach.com.ua/taiemnytsi-zamku-karak-karak/
rozum001,Привид Розумака (Ghost Blitz),594.0,True,https://geekach.com.ua/pryvyd-rozumaka-ghost-blitz/
R028UA,Хроніки пригод: У пошуках місячних каменів (Kids Chronicles: Quest for the Moon Stones),959.0,True,https://geekach.com.ua/kids-chronicles-quest-for-the-moon-stones/
R028UA,Місто шкереберть (Shake That City),1007.0,True,https://geekach.com.ua/misto-shkerebert-shake-that-city/
igrmstr04,Платформер (Platformer),1400.0,True,https://geekach.com.ua/platformer-platformer/
LOB2357UA,Таємниці замку Карак ІІ (Karak II),1990.0,True,https://geekach.com.ua/taiemnytsi-zamku-karak-ii-karak-ii/
rozum029,Пожежна вежа (Fire Tower),1199.0,True,https://geekach.com.ua/pozhezhna-vezha-fire-tower/
R046UA,Погана компанія (Bad Company),1899.0,True,https://geekach.com.ua/pohana-kompaniia-bad-company/
LOB2340UA,Квиток на потяг: Париж (Ticket To Ride: Paris),980.0,True,https://geekach.com.ua/kvytok-na-potiah-paryzh-ticket-to-ride-paris/
outh096,Борщ (Borscht),850.0,True,https://geekach.com.ua/borshch-borscht/
LOB2407UA,Мавпячий палац (Monkey Palace),1850.0,True,https://geekach.com.ua/mavpiachyi-palats-monkey-palace/
LOB2325UA,Welcome To Містечко мрій (Welcome To...),980.0,True,https://geekach.com.ua/welcome-to-mistechko-mrii-welcome-to.../
OTH0038,Планета (Planet),1444.0,True,https://geekach.com.ua/planeta-planet/
LOB2203UA,Качконіс (Platypus),810.0,True,https://geekach.com.ua/kachkonis-platypus/
LOB2204UA,Круті Перці (Chili Mafia),810.0,True,https://geekach.com.ua/kruti-pertsi-chili-mafia/
LOB2207UA,Піцаманія (Pizza Rush),299.0,True,https://geekach.com.ua/pitsamaniia-pizza-rush/
LOB2218UA,Довжина Хвилі (Wavelength),1690.0,True,https://geekach.com.ua/dovzhyna-khvyli-wavelength/
LOB2313UA,Піктоманія (Pictomania). Друге видання,850.0,True,https://geekach.com.ua/piktomaniia-pictomania.-druhe-vydannia/
outh052,Маскарад (Mascarade),980.0,True,https://geekach.com.ua/maskarad-mascarade/
outh055,Перекуп,850.0,True,https://geekach.com.ua/perekup/
LOB2304UA,Академія Мистецтв (Abstract Academy),360.0,True,https://geekach.com.ua/akademiia-mystetstv-abstract-academy/
outh058,Турбо: Спека на треку (Heat: Pedal to the metal),2790.0,True,https://geekach.com.ua/turbo-speka-na-treku-heat-pedal-to-the-metal/
LOB2308UA,Challengers! українське видання,1650.0,True,https://geekach.com.ua/challengers/
LOB2329UA,Лісова метушня (Forest Shuffle),1210.0,True,https://geekach.com.ua/lisova-metushnia-forest-shuffle/
LOB2331UA,Aqua. Океанське біорізноманіття (AQUA: Biodiversity in the oceans),1650.0,True,https://geekach.com.ua/aqua.-okeanske-bioriznomanittia-aqua-biodiversity-in-the-oceans/
LOB2338UA,Словомандри (Word Traveler),1750.0,True,https://geekach.com.ua/slovomandry-word-traveler/
outh089,Дитячий Експрес (Kids Express),1220.0,True,https://geekach.com.ua/dytiachyi-ekspres-kids-express/
LOB2402UA,Магія фей (Fairy Ring),1390.0,True,https://geekach.com.ua/mahiia-fei-fairy-ring/
LOB2110UA,Крихітні Акробати (Tiny Acrobats),1090.0,True,https://geekach.com.ua/kroshechnye-akrobaty-ukr-tiny-acrobats/
ppgs005,Скажи Сир! (Say Cheese),722.0,True,https://geekach.com.ua/skazhy-syr-say-cheese/
outh036,Камера! Мотор! Гра про Кіновиробництво (Roll Camera!: The Filmmaking),1950.0,True,https://geekach.com.ua/kamera-motor-hra-pro-kinovyrobnytstvo-roll-camera-the-filmmaking/
rozum002,Привид Розумака 2.0 (Ghost Blitz 2),524.0,True,https://geekach.com.ua/pryvyd-rozumaka-2.0-ghost-blitz-2/
FGS14,Мотиваційний Стікербук FGS,240.0,True,https://geekach.com.ua/motivatsionnyy-stikerbuk-fgs/
R009UA,Marvel Zombies: Опір Супергероїв,2199.0,True,https://geekach.com.ua/marvel-zombies-opir-superheroiv/
R041UA,Картолінія: Тварини (Cardline: Animals),487.0,True,https://geekach.com.ua/cardline-animals-kardlayn-zhivotnye/
IM1017UA,"Так, Темний Володарю! Червона Коробка (Aye, Dark Overlord!)",980.0,True,https://geekach.com.ua/da-temnyy-vlastelin-da-khozyain/
LOB2214UA,Рамен! Рамен! (Ramen! Ramen!),450.0,True,https://geekach.com.ua/ramen-ramen-ramen-ramen/
outh054,Формула Кохання (Love Formula),930.0,True,https://geekach.com.ua/formula-kokhannia-love-formula/
rozum003,"Привид Розумака, котра година? (Ghost Blitz: 5 to 12)",674.0,True,https://geekach.com.ua/pryvyd-rozumaka-kotra-hodyna-ghost-blitz-5-to-12/
R013UA,Рудокопи (Imperial Miners),1499.0,True,https://geekach.com.ua/rudokopy-imperial-miners/
igrmstr10,Створення Світу (World in Progress),940.0,True,https://geekach.com.ua/stvorennia-svitu-world-in-progress/
IM1018UA,"Так, Темний Володарю! Зелена Коробка (Aye, Dark Overlord!)",980.0,True,https://geekach.com.ua/tak-temnyi-volodariu-zelena-korobka-aye-dark-overlord/
R088UA,Ну дуже гучні бібліотекарі (Really Loud Librarians),1400.0,True,https://geekach.com.ua/nu-duzhe-huchni-bibliotekari-really-loud-librarians/
R064UA,"Або пан, або пропав (Without Fail)",1400.0,True,https://geekach.com.ua/abo-pan-abo-propav-without-fail/
R021UA,Planet B (Планета Б),2729.0,True,https://geekach.com.ua/planet-bplanet-b/
LOB2206UA,Кава (Café),810.0,True,https://geekach.com.ua/kava-cafe/
LOB2303UA,Турбозомбі (Troublez),450.0,True,https://geekach.com.ua/turbozombi-troublez/
LOB2318UA,Перші Залізниці (Pioneer Rails),850.0,True,https://geekach.com.ua/pioneer-rails/
LOB2201UA,Загублені руїни Арнаку. Лідери експедицій,1240.0,True,https://geekach.com.ua/zagubleni-ruini-arnaku.-lideri-ekspeditsiy/
LOB2311UA,Загублені руїни Арнаку: Зникла експедиція,1240.0,True,https://geekach.com.ua/zahubleni-ruiny-arnaku-znykla-ekspedytsiia-lost-ruins-of-arnak-the-missing-expedition/
R066UA,Часоряд (Timeline Twist),454.0,True,https://geekach.com.ua/taymlayn.-izbrannoe-timeline-diversity/
R043UA,Вибухові кошенята: Сингулярні кошенята (Imploding Kittens),799.0,True,https://geekach.com.ua/vybukhovi-kosheniata-nyshchivni-kosheniata/
R102UA,CATAN. Мореплавці (Seafarers),1690.0,True,https://geekach.com.ua/catan-moreplavtsi-seafarers/
R101UA,CATAN. Доповнення для 5-6 гравців,1120.0,True,https://geekach.com.ua/kolonizatory.-rasshirenie-dlya-5-6-igrokov/
R071UA,EXIT: Небіжчик у «Східному експресі» (Dead Man on the Orient Express),949.0,True,https://geekach.com.ua/exit-nebizhchyk-u-skhidnomu-ekspresi-dead-man-on-the-orient-express/
LOB2103UK,Кескіфе (Keskife),390.0,True,https://geekach.com.ua/keskife-ukr-keskife/
LOB2118UA,Ґолем (Golem),2200.0,True,https://geekach.com.ua/golem-golem/
MGLN086,Шалений карась (Happy Salmon),699.0,True,https://geekach.com.ua/vobla/
LOB2208UA,Герої та Маги (Heroes & Wizards),299.0,True,https://geekach.com.ua/heroi-ta-mahy-heroes-wizards/
LOB2221UA,Збери гурт (Band Grab),299.0,True,https://geekach.com.ua/zbery-hurt-band-grab/
LOB2314UA,Органи АТАКУЮТЬ! (Organ ATTACK!),630.0,True,https://geekach.com.ua/organattack/
R015UA,Монополія Знамениті місця Києва,1899.0,True,https://geekach.com.ua/monopoliia-znamenyti-mistsia-kyieva/
rozum021,Веселий Зайчик (Happy Bunny),714.0,True,https://geekach.com.ua/veselyi-zaichyk-happy-bunny/
LOB2323UA,Цікаві факти (Fun Facts),930.0,True,https://geekach.com.ua/tsikavi-fakty-fun-facts/
LOB2319UA,Гарячі Бургери (Burger ASAP!),540.0,True,https://geekach.com.ua/hariachi-burhery-burger-asap/
LOB2321UA,Mind Bug. Химерія: Перший контакт (Mindbug: First Contact),850.0,True,https://geekach.com.ua/mindbug-first-contact/
LOB2327UA,Диванні скелети (Couch Skeletons),299.0,True,https://geekach.com.ua/couch-skeletons/
LOB2337UA,Щур де Франс,600.0,True,https://geekach.com.ua/shchur-de-frans/
outh086,Суперняв (Super Meow),699.0,True,https://geekach.com.ua/superniav-super-meow/
LOB2339UA,Де моя КАПУСТА? (Where`s my CABBAGE?),899.0,True,https://geekach.com.ua/de-moia-kapusta-where`s-my-cabbage/
outh093,Хапай (Pikit),790.0,True,https://geekach.com.ua/khapai-pikit/
outh095,Монстросмакота (Monstrolicious),790.0,True,https://geekach.com.ua/monstrosmakota-monstrolicious/
rozum031,Млинці Анархії (Anarchy Pancakes),749.0,True,https://geekach.com.ua/mlyntsi-anarkhii-anarchy-pancakes/
rozum032,Концепт для дітей: Тварини (Concept Kids: Animals),1349.0,True,https://geekach.com.ua/kontsept-dlia-ditei-tvaryny-concept-kids-animals/
rozum034,Поезія для Неандертальців (Poetry for Neanderthals),1199.0,True,https://geekach.com.ua/poeziia-dlia-neandertaltsiv-poetry-for-neanderthals/
rozum036,Монополія Дива України,1899.0,True,https://geekach.com.ua/monopoliia-dyva-ukrainy/
LOB2348UA,Unlock! Короткі пригоди. Таємниці бабусиних рецептів,330.0,True,https://geekach.com.ua/unlock-korotki-pryhody.-taiemnytsi-babusynykh-retseptiv/
LOB2349UA,Unlock! Короткі пригоди. Пробудження мумії,330.0,True,https://geekach.com.ua/unlock-korotki-pryhody.-probudzhennia-mumii/
LOB2350UA,Unlock! Короткі пригоди. Політ ангела,330.0,True,https://geekach.com.ua/unlock-korotki-pryhody.-polit-anhela/
R069UA,Стадний інстинкт (Herd Mentality),999.0,True,https://geekach.com.ua/stadnyi-instynkt-herd-mentality/
D38980000,Dungeons & Dragons RPG - Character Sheets 2024,835.0,True,https://geekach.com.ua/dungeons-dragons-rpg-character-sheets-2024/
R070UA,Час Кексиків (Muffin Time),999.0,True,https://geekach.com.ua/chas-keksykiv-muffin-time/
LOB2345UA,Спогади в небі (Memories in the Sky),899.0,True,https://geekach.com.ua/spohady-v-nebi-memories-in-the-sky/
LOB2408UA,Мегамол 3000 (Superstore 3000),1160.0,True,https://geekach.com.ua/mehamol-3000-superstore-3000/
R076UA,Крик (Scream The Game),899.0,True,https://geekach.com.ua/kryk-scream-the-game/
R082UA,Губка Боб Квадратні Штани,1349.0,True,https://geekach.com.ua/hubka-bob-kvadratni-shtany/
R089UA,Я не мафія (YA NE MAFIA),499.0,True,https://geekach.com.ua/ya-ne-mafiia-ya-ne-mafia/
R072UA,EXIT: Зачарований ліс (The Enchanted Forest),949.0,True,https://geekach.com.ua/exit-zacharovanyi-lis-the-enchanted-forest/
R073UA,EXIT: Зникнення Шерлока Холмса (The Disappearance of Sherlock Holmes),949.0,True,https://geekach.com.ua/exit-znyknennia-sherloka-kholmsa-the-disappearance-of-sherlock-holmes/
LOB2410UA,Garden Rush. Українське видання,850.0,True,https://geekach.com.ua/garden-rush.-ukrainske-vydannia/
УКР036,"Зошит Розв'яжи-Напиши, 9-10 років",180.0,True,https://geekach.com.ua/zoshit-rozvyazhi-napishi-9-10-rokiv/
УКР035,"Зошит Розв'яжи-напиши, 7-8 років",180.0,True,https://geekach.com.ua/zoshit-rozvyazhi-napishi-7-8-rokiv/
УКР034,"Зошит Розв'яжи-напиши, 5-6 років",180.0,True,https://geekach.com.ua/zoshit-rozvyazhi-napishi-5-6-rokiv/
УКР-113,"Зошит Вирізалки, 3-4 роки",180.0,True,https://geekach.com.ua/zoshit-virizalki-3-4-roki/
УКР-114,"Зошит Вирізалки, 4-5 років",180.0,True,https://geekach.com.ua/zoshit-virizalki-4-5-rokiv/
LOB2205UA,Круті Перці. Славні Хлопці,330.0,True,https://geekach.com.ua/kruti-pertsi.-slavni-khloptsi/
outh091,Турбо: Дощі та грози (Heat: Heavy Rain),1360.0,True,https://geekach.com.ua/turbo-doshchi-ta-hrozy-heat-heavy-rain/
LOB2405UA,Лісова метушня. Альпи (Forest Shuffle: Alpine Expansion),450.0,True,https://geekach.com.ua/lisova-metushnia.-alpy-forest-shuffle-alpine-expansion/
LOB2117UA_exp,Colt Express: Happy 10th Anniversary (Кольт Експрес: з 10-ю річницею),920.0,True,https://geekach.com.ua/colt-express-happy-10th-anniversary-kolt-ekspres-z-10-iu-richnytseiu/
GKCH207fl,Промосценарій Ференц Ліст для гри Пілоти (Sky Team),150.0,True,https://geekach.com.ua/promostsenarii-ferents-list-dlia-hry-piloty-sky-team/
PRNRMDuc,Паранормальні детективи (Paranormal Detectives) УЦІНКА,1199.0,True,https://geekach.com.ua/paranormalni-detektyvy-paranormal-detectives-utsinka/
R016UA,Вранішнє сонце (Rising Sun) УЦІНКА,3359.0,True,https://geekach.com.ua/vranishnie-sontse-rising-sun-utsinka/
PZHNVZHuc,Пожежна вежа (Fire Tower) УЦІНКА,959.0,True,https://geekach.com.ua/pozhezhna-vezha-fire-tower-utsinka/
outh036dice,Металеві кубики (6 шт). Камера! Мотор! Гра про Кіновиробництво,450.0,True,https://geekach.com.ua/metalevi-kubyky-6-sht.-kamera-motor-hra-pro-kinovyrobnytstvo/
G7D0023,Аркуш 9 Pocket Page. 11 Holes - 100 micron (1 шт),18.0,True,https://geekach.com.ua/arkush-9-pocket-page.-11-holes-100-micron-1-sht/
95025,Подарунковий сертифікат на 500 грн,500.0,True,https://geekach.com.ua/podarochnyy-sertifikat-na-500-grn/
95026,Подарунковий сертифікат на 1000 грн,1000.0,True,https://geekach.com.ua/podarochnyy-sertifikat-na-1000-grn/
95027,Подарунковий сертифікат на 1500 грн,1500.0,True,https://geekach.com.ua/podarochnyy-sertifikat-na-1500-grn/
95028,Подарунковий сертифікат на 2000 грн,2000.0,True,https://geekach.com.ua/podarochnyy-sertifikat-na-2000-grn/
95029,Подарунковий сертифікат на будь-яку суму,0.0,True,https://geekach.com.ua/podarochnyy-sertifikat-na-lubuu-summu/
igrm091,Токени вірусів для гри Пандемія + доповнення На Межі,339.0,True,https://geekach.com.ua/tokeny-virusiv-dlia-hry-pandemiia-dopovnennia-na-mezhi/
GKCH008,Дюна: Імперіум (Dune: Imperium),2120.0,False,https://geekach.com.ua/duna-imperium-ukr-dune-imperium/
GKST003UA,Магія слів (Words of Magic),1099.0,False,https://geekach.com.ua/mahiia-sliv/
GKCH0245,Володар Перснів. Доля братства (The Lord of the Rings: Fate of the Fellowship),2950.0,False,https://geekach.com.ua/volodar-persniv.-dolia-bratstva-the-lord-of-the-rings-fate-of-the-fellowship/
GKCH020UM,Unmatched: Битва легенд. Частина перша,1575.0,False,https://geekach.com.ua/unmatched-bitva-legend/
GKCH220in,Оборонці нетрів (Defenders of the Wild),2200.0,False,https://geekach.com.ua/oborontsi-netriv-defenders-of-the-wild/
GKRP0028,"Fallout. Рольова гра - Стартовий набір, Друкований",1279.0,False,https://geekach.com.ua/fallout.-rolova-hra-startovyi-nabir/
GKCH235ee,Зомбіцид. Біла смерть - Нескорена Імперія (Zombicide: White Death – Eternal Empire),2350.0,False,https://geekach.com.ua/zombitsyd.-neskorena-imperiia-zombicide-white-death-eternal-empire/
GKCH0244,Дюна. Імперіум - Династії (Dune: Imperium – Bloodlines),1520.0,False,https://geekach.com.ua/diuna.-imperium-dynastii-dune-imperium-bloodlines/
gsds043,Край Андромеди (Andromeda's Edge),3150.0,False,https://geekach.com.ua/krai-andromedy-andromedas-edge/
