id,name,price,in_stock,link
GKCH221ti,Сутінки імперії. Четверте видання (Twilight Imperium: Fourth Edition),7250.0,True,https://geekach.com.ua/sutinky-imperii.-chetverte-vydannia-twilight-imperium-fourth-edition/
GKCH028VP,Війна Персня (War of the Ring),3890.0,True,https://geekach.com.ua/viyna-persnya-war-of-the-ring-voyna-koltsa-ukr/
GKCH187gt,Гра престолів. Друге видання (A Game of Thrones: The Board Game Second Edition),2950.0,True,https://geekach.com.ua/hra-prestoliv.-druhe-vydannia-a-game-of-thrones-the-board-game/
GKCH151BR,Лють крові (Blood Rage),3780.0,True,https://geekach.com.ua/liut-krovi-blood-rage/
GKCH104EH,Прадавній жах (Eldritch Horror),2950.0,True,https://geekach.com.ua/pradavnii-zhakh-eldritch-horror/
GKCH229cs,Кіклади. Легендарне видання (Cyclades: Legendary Edition),3250.0,True,https://geekach.com.ua/kiklady.-lehendarne-vydannia-cyclades-legendary-edition/
GKCH064BK,Королівство кроликів (Bunny Kingdom),2150.0,True,https://geekach.com.ua/korolevstvo-krolikov-bunny-kingdom/
GKCH095M,Маєтки божевілля (Mansions of Madness Second Edition),4550.0,True,https://geekach.com.ua/maietky-bozhevillia-mansions-of-madness-second-edition/
GKCH050AH3,Жах Аркгема. Третя редакція (Arkham Horror Third Edition),3250.0,True,https://geekach.com.ua/zhakh-arkgema.-tretya-redaktsiya-arkham-horror-third-edition/
GKCH001,Острів котів (The Isle of Cats),2250.0,True,https://geekach.com.ua/the-isle-of-cats/
GKCH009UM,Утрачені моря. Перехрестя пригод (Forgotten Waters),2590.0,True,https://geekach.com.ua/utracheni-morya-forgotten-waters-zabytye-morya-ukr/
GKCH019KT,Кемет: Кров і пісок (Kemet: Blood and Sand),3350.0,True,https://geekach.com.ua/kemet-krov-i-pesok-kemet-blood-and-sand/
GKCH143Z2E,Зомбіцид. Друга редакція (Zombicide: 2nd Edition),4600.0,True,https://geekach.com.ua/zombitsyd.-druha-redaktsiia/
GKCH043DS,Дюна. Таємниці Домів (Dune: House Secrets),1710.0,True,https://geekach.com.ua/duna.-taiemnitsi-domu-dune-house-secrets/
GKCH052TL,Петля (The Loop),1592.0,True,https://geekach.com.ua/petlya-the-loop/
GKCH065DS,Distilled. Таємниці напоїв,3450.0,True,https://geekach.com.ua/distilled.-taiemnitsi-napoiv/
GKCH100OL,Ольтре (Oltréé) + промо,2800.0,True,https://geekach.com.ua/oltre-oltree/
GKCH105CC,Кланк! Катакомби (Clank! Catacombs),2600.0,True,https://geekach.com.ua/klank-katakomby-clank-catacombs/
GKCH102WR,Війна Персня. Карткова гра (War of the Ring: The Card Game),1400.0,True,https://geekach.com.ua/viina-persnia.-kartkova-hra-war-of-the-ring-the-card-game/
GKCH200rb,Зоряні війни: Повстання (Star Wars: Rebellion),4600.0,True,https://geekach.com.ua/zoriani-viiny-povstannia-star-wars-rebellion/
GKCH114CEO,Поклик пригод. Спадок героїв (Call To Adventure: Epic Origins),1750.0,True,https://geekach.com.ua/poklyk-pryhod.-spadok-heroiv/
GKCH125SJ,Сенджюцу. Битва за Японію (Senjutsu: Battle For Japan),1950.0,True,https://geekach.com.ua/sendzhiutsu.-bytva-za-yaponiiu/
GKCH140AE,Кінець віків (Aeon’s End),1950.0,True,https://geekach.com.ua/kinets-vikiv-aeons-end/
GKCH065full,Distilled. Набір з доповненням,4400.0,True,https://geekach.com.ua/distilled.-taiemnytsi-napoiv-povnyi-nabir/
GKCH155,Володар Перснів. Карткова гра (The Lord of the Rings: The Card Game),2699.0,True,https://geekach.com.ua/volodar-persniv.-kartkova-hra-the-lord-of-the-rings-the-card-game-revised-core-set/
GKCH156,Експедиції (Expeditions),3250.0,True,https://geekach.com.ua/expeditions-ukr/
GKCH160,Нортґард. Незвідані землі (Northgard: Uncharted Lands),2950.0,True,https://geekach.com.ua/nortgard.-nezvidani-zemli/
GKCH163,Unmatched: Пригоди - Дивовижні оповідки (Unmatched Adventures: Tales to Amaze),2950.0,True,https://geekach.com.ua/unmatched-adventures-tales-to-amaze/
GKCH164,Книга магії (Spellbook),1499.0,True,https://geekach.com.ua/knyha-mahii-spellbook/
GKCH166,Radlands. Українське видання,840.0,True,https://geekach.com.ua/redlendz-radlands/
GKCH167T,Істота. Настільна гра (The Thing: The Boardgame),2250.0,True,https://geekach.com.ua/istota.-nastilna-hra-the-thing-the-boardgame/
GKCH181up,Дюна: Імперіум - Піднесення (Dune: Imperium – Uprising),2950.0,True,https://geekach.com.ua/diuna-imperium-pidnesennia-dune-imperium-uprising/
GKCH186dw,Дюна. Війна за Арракіс (Dune: War for Arrakis),5800.0,True,https://geekach.com.ua/diuna.-viina-za-arrakis-dune-war-for-arrakis/
GKCH228nc,Cyberpunk 2077. Банди Найт-Сіті (Gangs of Night City),4600.0,True,https://geekach.com.ua/cyberpunk-bandy-nait-siti-gangs-of-night-city/
GKCH2402,Ера інновацій (Age of Innovation),3999.0,True,https://geekach.com.ua/era-innovatsii-age-of-innovation/
GKCH234wd,Зомбіцид. Біла смерть (Zombicide: White Death),4700.0,True,https://geekach.com.ua/zombitsyd.-bila-smert-zombicide-white-death/
GKCH185se,Пори року (Seasons),2100.0,True,https://geekach.com.ua/pory-roku-seasons/
GKCH194cv,Цивілізація. Новий світанок (Civilization: A New Dawn),2650.0,True,https://geekach.com.ua/tsyvilizatsiia.-novyi-svitanok-civilization-a-new-dawn/
GKCH184df,Кузня долі (Dice Forge),2100.0,True,https://geekach.com.ua/dice-forge-hrani-doli/
GKCH174dt,Детектив. Сучасне розслідування (Detective: A Modern Crime Board Game),2050.0,True,https://geekach.com.ua/detektyv.-suchasne-rozsliduvannia-detective-a-modern-crime-board-game/
GKCH016ZKE,Діти проти зомбі (Zombie Kidz Evolution),975.0,True,https://geekach.com.ua/diti-proti-zombi-zombie-kidz-evolution/
GKCH017ZTE,Підлітки проти зомбі (Zombie Teenz Evolution),975.0,True,https://geekach.com.ua/zte/
GKCH177ds,Призначення (Destinies),2250.0,True,https://geekach.com.ua/pryznachennia-destinies/
GKCH189es,Знак Старших богів (Elder Sign),1950.0,True,https://geekach.com.ua/znak-starshykh-bohiv-elder-sign/
GKCH207st,Пілоти (Sky Team),1295.0,True,https://geekach.com.ua/piloty-sky-team/
GKCH211ml,Зоряні війни: Мандалорець - Пригоди (Star Wars: The Mandalorian Adventures),2450.0,True,https://geekach.com.ua/zoriani-viiny-mandalorets-pryhody-star-wars-the-mandalorian-adventures/
GKST001UA,Медова пригода + промо,475.0,True,https://geekach.com.ua/medova-pryhoda/
GKCH224fs,Братство Персня. Карткова гра (The Fellowship of the Ring The Trick Taking Game),1050.0,True,https://geekach.com.ua/bratstvo-persnia.-kartkova-hra-the-fellowship-of-the-ring-the-trick-taking-game/
GKCH014TK,Такеноко (Takenoko),2150.0,True,https://geekach.com.ua/takenoko-takenoko/
GKCH022CC,Лісовий затишок (Creature Comforts),2050.0,True,https://geekach.com.ua/lisoviy-zatishok-creature-comforts/
GKCH027S,Саґрада (Sagrada),1950.0,True,https://geekach.com.ua/sagrada-sagrada/
GKCH026RR,Червоний світанок (Red Rising),1790.0,True,https://geekach.com.ua/chervoniy-svitanok-red-rising-aloe-vosstanie/
GKCH029CL,Коатль (Coatl) + промо,870.0,True,https://geekach.com.ua/koatl-coatl/
GKCH033CUB,Кубітос (Cubitos),2200.0,True,https://geekach.com.ua/kubitos-cubitos/
GKCH035MU,Marvel United. Українське видання,1650.0,True,https://geekach.com.ua/marvel-united/
GKCH159,Племена вітру (Tribes of the Wind),1950.0,True,https://geekach.com.ua/plemena-vitru-tribes-of-the-wind/
GKCH168SW,Зоряні війни. Колодобудівна гра (Star Wars: The Deckbuilding Game),1700.0,True,https://geekach.com.ua/zoriani-viiny.-kolodobudivna-hra-star-wars-the-deckbuilding-game/
GKCH170mm,MIND MGMT: Ігри розуму,2550.0,True,https://geekach.com.ua/mind-mgmt-the-psychic-espionage-game./
GKCH214ml,MLEM. Космічне агентство (MLEM: Space Agency),1320.0,True,https://geekach.com.ua/mlem.-kosmichne-ahentstvo-mlem-space-agency/
GKCH220in,Інорі (Inori),1499.0,True,https://geekach.com.ua/inori-inori/
GKCH215mv,Кленова долина (Maple Valley),1550.0,True,https://geekach.com.ua/klenova-dolyna-maple-valley/
GKCH217bg,Бенґ! (BANG!),850.0,True,https://geekach.com.ua/beng-bang/
GKCH021RB,Unmatched: Робін Гуд проти Біґфута,1075.0,True,https://geekach.com.ua/unmatched-robin-gud-proti-bigfuta/
GKCH03536,Комплект Marvel United + У всесвіті Людини-павука,2248.0,True,https://geekach.com.ua/komplekt-marvel-united-u-vsesviti-ludini-pavuka/
GKCH158,Котяча риберня (Fish & Katz),880.0,True,https://geekach.com.ua/kotiacha-rybernia-fish-katz/
GKCH169tm,Машина Тюрінга (Turing Machine),1360.0,True,https://geekach.com.ua/mashyna-tiurinha-turing-machine/
GKCH171ct,Космоспрут (Cosmoctopus),1520.0,True,https://geekach.com.ua/cosmoctopus/
GKCH173ps,Пасажири (Passengers),1150.0,True,https://geekach.com.ua/pasazhyry-passengers/
GKCH196bh,Зоряні війни. Мисливці за головами (Star Wars: Bounty Hunters),950.0,True,https://geekach.com.ua/zoriani-viiny.-myslyvtsi-za-holovamy-star-wars-bounty-hunters/
GKCH208rt,Рятуй котів (Race to the Raft),1950.0,True,https://geekach.com.ua/riatui-kotiv-race-to-the-raft/
GKCH209nj,Некоджіма (Nekojima),1700.0,True,https://geekach.com.ua/nekodzhima-nekojima/
GKCH199so,Unmatched: Схід сонця (Sun's Origin),1075.0,True,https://geekach.com.ua/unmatched-skhid-sontsia-suns-origin/
GKCH201sp,Мегаполіс. Повне видання (Sprawlopolis),395.0,True,https://geekach.com.ua/megapolis-megapolis/
GKCH099AR,Авалон (Avalon Класична версія),608.0,True,https://geekach.com.ua/avalon.-prykhovana-zahroza-klasychna-versiia/
GKCH006,З молотка! (For Sale),599.0,True,https://geekach.com.ua/z-molotka-for-sale-prodano/
GKRP0013,Cyberpunk RED. Стартовий набір / Jumpstart Kit,1599.0,True,https://geekach.com.ua/cyberpunk-red-jumpstart-kit/
GKCH007,Одним словом (Just One),790.0,True,https://geekach.com.ua/odnim-slovom-just-one-namek-ponyal/
GKCH010ORI,Орифлама (Oriflamme),595.0,True,https://geekach.com.ua/oriflamma-oriflamme/
GKRP0008,"Поклик Ктулху. Базовий набір (Call of Cthulhu Starter Set), Друкований",1150.0,True,https://geekach.com.ua/poklyk-ktulkhu.-bazovyi-nabir-call-of-cthulhu-starter-set/
GKCH204tm,Мова квітів. Повне видання (Tussie Mussie),296.0,True,https://geekach.com.ua/mova-kvitiv.-povne-vydannia-tussie-mussie/
GKCH231uu,Відчайдушні однороги (Unstable Unicorns),995.0,True,https://geekach.com.ua/vidchaidushni-odnorohy-unstable-unicorns/
GKCH034HL,Таємні лідери (Hidden Leaders),850.0,True,https://geekach.com.ua/taiemni-lideri-hidden-leaders/
GKCH142MH1,Монстри проти героїв. Вікторіанські жахи,450.0,True,https://geekach.com.ua/monstry-proty-heroiv.-viktorianski-zhakhy/
GKCH044OKM,Острів котів. Мандруй та малюй (The Isle of Cats Explore & Draw),1200.0,True,https://geekach.com.ua/ostriv-kotiv.-mandruy-i-maluy/
GKCH063ST,Шотен Тотен (Schotten Totten),599.0,True,https://geekach.com.ua/schotten-totten-ukr/
GKCH069RF,Riftforce. Сила розлому,900.0,True,https://geekach.com.ua/riftforce/
GKCH180bc,Пачка чипсів (Bag of Chips),475.0,True,https://geekach.com.ua/pachka-chypsiv-bag-of-chips/
GKCH073SP,Sweet & Spicy. Битва котиків,495.0,True,https://geekach.com.ua/sweet-spicy.-bitva-kotikiv/
GKCH072HM,Голодна мавпа (Hungry Monkey),396.0,True,https://geekach.com.ua/golodna-mavpa-hungry-monkey/
GKCH067LV,Level 10. Десятий рівень,375.0,True,https://geekach.com.ua/level-10.-desyatiy-riven/
GKCH068TT,Стежки Тукани (Trails of Tucana),700.0,True,https://geekach.com.ua/stezhki-tukani-trails-of-tucana/
GKCH079BM,B Movies. (НЕ)погане кіно (Обк. Робот-убивця),440.0,True,https://geekach.com.ua/b-movies.-nepogane-kino/
GKCH086FN,За Нортвуд! (For Northwood! A Solo Trick-Taking Game),425.0,True,https://geekach.com.ua/za-nortvud/
GKCH087VN,Велонімо (Velonimo),475.0,True,https://geekach.com.ua/velonimo-velonimo/
GKCH093SSP,Чемпіонський пінбол (Super-Skill Pinball: 4-Cade),490.0,True,https://geekach.com.ua/chempionskiy-pinbol/
GKCH079BM,B Movies. (НЕ)погане кіно (Обк. Щупальця),440.0,True,https://geekach.com.ua/b-movies.-nepogane-kino-2/
GKCH097A,Орифлама. Альянс (Oriflamme: Alliance),595.0,True,https://geekach.com.ua/oryflama.-alians-oriflamme-alliance/
GKCH098AQ,Остання місія (Quest),780.0,True,https://geekach.com.ua/avalon.-ostannia-misiia-quest/
GKCH101ICP,Аркадний автомат (Insert Coin to play),340.0,True,https://geekach.com.ua/arkadnyi-avtomat-insert-coin-to-play/
GKCH110ARN,Авалон (Avalon Нова версія),760.0,True,https://geekach.com.ua/avalon.-prykhovana-zahroza-nova-versiia/
GKCH103OC,Кишенькове підземелля (One Card Dungeon),450.0,True,https://geekach.com.ua/kyshenkove-pidzemellia-one-card-dungeon/
GKCH113YOK,Йокаї (Yokai),450.0,True,https://geekach.com.ua/yokai-yokai/
GKCH111SK,Череп (Skull),799.0,True,https://geekach.com.ua/cherep-skull/
GKCH126W,Мигцем. Шпигунські ігри (Wink: Nest of Spies),595.0,True,https://geekach.com.ua/myhtsem-wink-nest-of-spies/
GKCH146,Гікорі Дікорі (Hickory Dickory),2350.0,True,https://geekach.com.ua/hikori-dikori-hickory-dickory/
GKCH147,Картавентура. Лхаса (Cartaventura: Lhasa),500.0,True,https://geekach.com.ua/kartaventura-lkhasa/
GKCH150,Монстри проти героїв. Поклик Ктулху,450.0,True,https://geekach.com.ua/monstry-proty-heroiv.-poklyk-ktulkhu/
GKCH157,Жар-хвостики (Tails on Fire),396.0,True,https://geekach.com.ua/zhar-khvostyky-tails-on-fire/
GKCH162,Спліто (Splito),475.0,True,https://geekach.com.ua/splito-splito/
GKCH165so,Склеп черепів. Повне видання (Skulls of Sedlec),395.0,True,https://geekach.com.ua/sklep-cherepiv.-povne-vydannia-skulls-of-sedlec/
GKCH172bc,Битви гербів. Базова гра: Безлистий ліс (Battlecrest: Fellwoods Base Game),340.0,True,https://geekach.com.ua/battlecrest-fellwoods-base-game/
EKITTB01UA,Летючі бурито (Throw Throw Burrito),1299.0,True,https://geekach.com.ua/letiuchi-buryto-throw-throw-burrito/
GKCH183tu,Час збігає! Вечірка (Time's Up! Party Edition),680.0,True,https://geekach.com.ua/chas-zbihaie-vechirka-times-up-party-edition/
GKRP0008,Поклик Ктулху. Базовий набір (Call of Cthulhu Starter Set) Електронний,395.0,True,https://geekach.com.ua/poklyk-ktulkhu.-bazovyi-nabir-call-of-cthulhu-starter-set-elekronnyi/
GKCH182ai,Майже невинні (Almost Innocent),1300.0,True,https://geekach.com.ua/maizhe-nevynni-almost-innocent/
GKCH206wt,Хвостаті пригоди. Піратський спадок (Wildtails: A Pirate Legacy),296.0,True,https://geekach.com.ua/khvostati-pryhody.-piratskyi-spadok-wildtails-a-pirate-legacy/
GKCH214sd,Чорне море (Seaside),1250.0,True,https://geekach.com.ua/chorne-more-seaside/
GKCH212sp,Підозрювані. За справу береться Клер Гарпер (Suspects),1375.0,True,https://geekach.com.ua/pidozriuvani.-za-spravu-beretsia-kler-harper-suspects/
GKCH213sc,Підозрювані 2. Невгамовна дослідниця Клер Гарпер (Suspects 2),1375.0,True,https://geekach.com.ua/pidozriuvani-2.-nevhamovna-doslidnytsia-kler-harper-suspects-2/
GKCH214ai,ШІ. Космічна пригода (AI Space Puzzle),1250.0,True,https://geekach.com.ua/shi.-kosmichna-pryhoda-ai-space-puzzle/
GKRP0025dg,Поклик Ктулху. Сценарій Шкряб-шкряб Електронний,199.0,True,https://geekach.com.ua/poklyk-ktulkhu.-stsenarii-shkriab-shkriab-elektronnyi/
GKCH227ms,Убивчі креветки (Mantis),850.0,True,https://geekach.com.ua/ubyvchi-krevetky-mantis/
GKRP0023,Cyberpunk RED. Стартовий набір / Jumpstart Kit Електронний,699.0,True,https://geekach.com.ua/cyberpunk-red.-startovyi-nabir-/-jumpstart-kit-elektronnyi/
GKRP0028,Fallout. Рольова гра - Стартовий набір Електронний,550.0,True,https://geekach.com.ua/fallout.-rolova-hra-startovyi-nabir-elektronnyi/
GKRP0020,"Vaesen. Таємничі істоти півночі / Весен, Друкований",1399.0,True,https://geekach.com.ua/vaesen-nordic-horror-rpg/
GKRP0019,Vaesen. Таємничі істоти півночі / Весен Електронний,699.0,True,https://geekach.com.ua/vaesen.-taiemnychi-istoty-pivnochi-vesen-elektronnyi/
GKRP0021,"Поклик Ктулху. Набір Вартового (Call of Cthulhu Keeper Screen Pack), Друкований",1150.0,True,https://geekach.com.ua/poklyk-ktulkhu.-nabir-vartovoho-call-of-cthulhu-keeper-screen-pack/
GKRP0022,"Поклик Ктулху. Набір Вартового Електронний (Call of Cthulhu Keeper Screen Pack), Електронний",550.0,True,https://geekach.com.ua/poklyk-ktulkhu.-nabir-vartovoho-elektronnyi-call-of-cthulhu-keeper-screen-pack/
GKCH202ap,Агрополіс (Agropolis),180.0,True,https://geekach.com.ua/ahropolis-agropolis/
GKCH205dv,Долина Смерті. Розширене видання (Death Valley),180.0,True,https://geekach.com.ua/dolyna-smerti.-rozshyrene-vydannia-death-valley/
GKCH056WS,Дика природа. Серенгеті (Wild: Serengeti),1480.0,True,https://geekach.com.ua/dika-priroda.-serengeti/
GKCH058AH31,Жах Аркгема. Третя редакція: Нічний морок (Arkham Horror: Dead of Night),1250.0,True,https://geekach.com.ua/zhakh-arkgema.-tretya-redaktsiya-nichniy-morok/
GKCH081SM,Зачаровані (Smitten),195.0,True,https://geekach.com.ua/zacharovani-smitten/
GKRP0003,Шалені світи. Пригодницьке видання - Книга правил (Savage Worlds Core Rules),1399.0,True,https://geekach.com.ua/shaleni-svity-pryhodnytske-vydannia-knyha-pravyl-savage-worlds-adventure-edition-core-rules/
GKCH175we,Війна Персня. Карткова гра - Проти тіні (War of the Ring: The Card Game – Against the Shadow),660.0,True,https://geekach.com.ua/viina-persnia.-kartkova-hra-proty-tini-war-of-the-ring-the-card-game-against-the-shadow/
GKCH178wt,Призначення. Відьмин ліс (Destinies: Witchwood),1700.0,True,https://geekach.com.ua/pryznachennia.-vidmyn-lis-destinies-witchwood/
GKRP0003,Шалені світи. Пригодницьке видання - Книга правил (Savage Worlds Core Rules) Електронний,699.0,True,https://geekach.com.ua/shaleni-svity.-pryhodnytske-vydannia-knyha-pravyl-savage-worlds-core-rules-elektronnyi/
GKCH218dc,Бенґ! Додж-Сіті (BANG! DodgeCity),725.0,True,https://geekach.com.ua/beng-dodzh-siti-bang-dodgecity/
ig1302,Містеріум (Mysterium),1199.0,True,https://geekach.com.ua/mysterium/
GKCH223bt,Маєтки божевілля. За порогом (Mansions of Madness: Beyond the Threshold),1350.0,True,https://geekach.com.ua/maietky-bozhevillia.-za-porohom-mansions-of-madness-beyond-the-threshold/
GKCH225sp,Саґрада. Пристрасть (Sagrada: Passion),950.0,True,https://geekach.com.ua/sagrada.-prystrast-sagrada-passion/
GKCH195ti,Цивілізація. Новий світанок — Тера інкогніта (Civilization: A New Dawn – Terra Incognita),2100.0,True,https://geekach.com.ua/tsyvilizatsiia.-novyi-svitanok-tera-inkohnita-civilization-a-new-dawn-terra-incognita/
GKCH226sl,Саґрада. Життя (Sagrada: Life),950.0,True,https://geekach.com.ua/sagrada.-zhyttia-sagrada-life/
IGAMES011,Новий ковчег (Ark Nova),3199.0,True,https://geekach.com.ua/novyi-kovcheh-ark-nova/
11013,Містеріум. Повний комплект,2207.0,True,https://geekach.com.ua/misterium.-polnyy-komplekt/
GKCH025MG,Відьмак. Старий світ - Маги (The Witcher: Old World – Mages),2520.0,True,https://geekach.com.ua/vidmak.-stariy-svit-magi/
GKCH025SK,Відьмак. Старий світ - Скелліге (The Witcher: Old World – Skellige),2100.0,True,https://geekach.com.ua/vidmak.-stariy-svit-skellige/
DNTDEB,Комплект Дюна. Таємниці Домів + Ексклюзивні бонуси,1921.0,True,https://geekach.com.ua/diuna.-taiemnytsi-domiv-ekskliuzyvni-bonusy/
GKCH179fl,Таємні лідери. Забуті легенди (Hidden Leaders: Forgotten Legends),750.0,True,https://geekach.com.ua/taiemni-lidery.-zabuti-lehendy-hidden-leaders-forgotten-legends/
WM04623-EN1-6,Monopoly: Witcher (Монополія: Відьмак),1759.0,True,https://geekach.com.ua/monopoly-uk-witcher-monopoliia-vidmak/
51310,Kanagawa (Канагава),1250.0,True,https://geekach.com.ua/kanagawa/
80021,Манчкін (Munchkin),745.0,True,https://geekach.com.ua/munchkin-ukr/
GKCH153BR,Лють крові. Боги Асґарду (Blood Rage: Gods of Ásgard),840.0,True,https://geekach.com.ua/liut-krovi.-bohy-asgardu/
GKCH154BR,Лють крові. Чаклуни Мідґарду (Blood Rage: Mystics of Midgard),1050.0,True,https://geekach.com.ua/liut-krovi.-chakluny-midgardu/
GKCH152BR,Лють крові. П’ятий гравець (Blood Rage: 5th Player Expansion),1260.0,True,https://geekach.com.ua/liut-krovi.-piatyi-hravets/
ig1803,Детектив Клуб,1199.0,True,https://geekach.com.ua/detektiv-klub/
kilo004,Marvel Champions. Карткова гра (Чемпіони Марвел),2440.0,True,https://geekach.com.ua/marvel-champions.-kartkova-gra-chempiony-marvel-ukr/
kg11974,Star Wars. Зовнішнє кільце (Star Wars Outer Rim),3950.0,True,https://geekach.com.ua/star-wars.-zovnishnie-kiltse-star-wars-outer-rim/
GKCH015TKC,Такеноко: Чібіс (Takenoko: Chibis),900.0,True,https://geekach.com.ua/takenoko-chibis-takenoko-chibis/
yelb001,Пройдисвіти Кведлінбурга (The Quacks of Quedlinburg),1695.0,True,https://geekach.com.ua/proydisviti-kvedlinburga-sharlatany-iz-kvedlinburga-ukr/
IGAMES008,Форпост (Settlement),1599.0,True,https://geekach.com.ua/forpost/
GKCH045OKK,Острів котів: Кошенята і звірята (The Isle of Cats: Kittens + Beasts),1150.0,True,https://geekach.com.ua/ostriv-kotiv-koshenyata-i-zviryata/
GKCH066AM,Distilled. Африка та Близький Схід,950.0,True,https://geekach.com.ua/distilled.-afrika-ta-blizkiy-skhid/
100822,Перша настільна мемарня (What do you meme),749.0,True,https://geekach.com.ua/persha-nastilna-memarnya-what-do-you-meme/
gsds020,Дюна: Гра про війну та дипломатію (Dune: A Game of Conquest and Diplomacy),2390.0,True,https://geekach.com.ua/duna-gra-pro-viynu-ta-diplomatiu-dune-a-game-of-conquest-and-diplomacy/
FGS40,Битва Катапульт (Catapult Feud),1699.0,True,https://geekach.com.ua/bytva-katapult-catapult-feud/
BMB017,"Love Фанти ""69 або Ігри в ліжку""",799.0,True,https://geekach.com.ua/love-fanty-69-abo-ihry-v-lizhku/
GKCH134,Дюна: Імперіум – Безсмертя (Dune: Imperium – Immortality),1450.0,True,https://geekach.com.ua/dune-imperium-immortality/
GKCH135lm,Війна Персня. Володарі Середзем’я (War of the Ring: Lords of Middle-earth),1400.0,True,https://geekach.com.ua/war-of-the-ring-lords-of-middle-earth/
GKCH136wm,Війна Персня. Воїни Середзем’я (War of the Ring: Warriors of Middle-earth),2150.0,True,https://geekach.com.ua/war-of-the-ring-warriors-of-middle-earth/
GKCH137fe,Війна Персня. Доля Еребору (War of the Ring: The Fate of Erebor),450.0,True,https://geekach.com.ua/war-of-the-ring-the-fate-of-erebor/
GKCH138km,Війна Персня. Королі Середзем’я (War of the Ring: Kings of Middle-earth),1850.0,True,https://geekach.com.ua/war-of-the-ring-kings-of-middle-earth/
GKCH161,Немезида. Наслідки (Nemesis: Aftermath),3150.0,True,https://geekach.com.ua/nemezyda.-naslidky/
402223,Паскудні карти (Cards Against Humanity),749.0,True,https://geekach.com.ua/paskudni-karty-cards-against-humanity/
GKCH203e1,Битви гербів. Набір доповнень #1 (Battlecrest: Expansion Collection #1),180.0,True,https://geekach.com.ua/bytvy-herbiv.-nabir-dopovnen-1-battlecrest-expansion-collection-1/
GKCH229hr,Кіклади. Легендарне видання - Монстри і герої (Cyclades: Creatures & Heroes),1350.0,True,https://geekach.com.ua/kiklady.-lehendarne-vydannia-monstry-i-heroi-cyclades-creatures-heroes/
GKCH229tf,Кіклади. Легендарне видання - Загони і флот (Cyclades: Troops & Fleets),2950.0,True,https://geekach.com.ua/kiklady.-lehendarne-vydannia-zahony-i-flot-cyclades-troops-fleets/
WM03852-EN1-6,Risk: The Lord of the Rings (Ризик: Володар перснів),2789.0,True,https://geekach.com.ua/risk-the-lord-of-the-rings-ryzyk-volodar-persniv/
